video_id,title,publishedAt,channelId,channelTitle,categoryId,trending_date,tags,view_count,likes,dislikes,comment_count,thumbnail_link,comments_disabled,ratings_disabled,description
"tz-sQ5Vqag8","女優のコンビニ飯をセブンイレブンで爆買いして爆食いしたけど一ミリも女優感ない動画に仕上がったのはまじでいつもの事でお先真っ暗闇","2022-11-09T11:00:42Z","UCJyGoLz_sLHHHI1uEPg6UhA","仲里依紗です。","22","22.15.11","仲里依紗|仲里 依紗|なかりいさ|ナカリイサ|Naka Riisa|Nakazato Riisa|仲依 里紗|仲里依紗です|Naka Riisa desu","816906","0","0","670","https://i.ytimg.com/vi/tz-sQ5Vqag8/default.jpg","False","True","セブンイレブンいい気分🌺🫶🏻InstagramとTwitterもフォローよろしくね❤️Instagram☆☆☆https://instagram.com/riisa1018nakaTwitter☆☆☆https://twitter.com/riisa1018nakaTikTok☆☆☆https://vt.tiktok.com/ZSd6n8KmE/👗RE.オフィシャル通販サイト👗https://1989re.com/🎀RE.のインスタ🎀https://www.instagram.com/re._oyoufukuyasan_💙RE.れいちゃんのインスタ💙https://www.instagram.com/re._reichan_/#仲里依紗 #セブンイレブン"
"1oxIe71PPPA","【お弁当人気10選】インスタ＆家族人気のお弁当をご紹介！簡単なレシピと、質問返しも。","2022-11-08T10:45:38Z","UCx6uHC-VzNeakSFECf-U90A","TAKIMAKI Channel / 滝沢眞規子Official","22","22.15.11","[none]","329247","0","0","171","https://i.ytimg.com/vi/1oxIe71PPPA/default.jpg","False","True","TAKIMAKI CHANNELスタッフです✨今回は、久しぶりの「お弁当」企画です♪今年2022年にインスタグラムに投稿したお弁当の中でみなさまからのイイネ👍が多かったTOP10選をご紹介します！毎朝5時には起きているタキマキ。冬だと真っ暗闇の中で準備を始めるそうです..いつもスタッフが朝起きて携帯を開くとすでに何時間も前から頭フル回転で動いているタキマキから連絡が入っていることも（笑）本当いつもすごいなぁと単純に尊敬をしていますが、そんなお弁当のこだわり、ポイント、味付けなどを聞きました✨✨タキマキについて語ると、長文になってしまうのでぜひ動画を最後までご覧いただけると嬉しいです💕"
"pjDRQih_uGc","ヒット量産の秘密は「腕を使わないこと」イチローが憧れた男・田尾安志の打撃術 【バッターズバイブル】","2022-11-08T12:00:30Z","UCbf6IAYfPy8CwHVgcHbxmNw","フルタの方程式【古田敦也 公式チャンネル】","17","22.15.11","[none]","501841","0","0","404","https://i.ytimg.com/vi/pjDRQih_uGc/default.jpg","False","True","中日・西武などで活躍され、通算3度の最多安打を記録したヒットメーカー・田尾安志さん。コーチとしても多くの選手を育てた田尾さんに、バッティングのコツを伺いました。フルタの方程式のご出演者最年長とは思えない、甘いマスクも健在です！▼田尾安志さんのチャンネルはコチラ▼https://www.youtube.com/channel/UCujKx9MOD0zja02WXkDAwwA▼福島レッドホープスのチャンネルはコチラ▼https://www.youtube.com/channel/UCOJRPuEsKe8hD-ufg1_nVtg▼これまでのバッターズバイブルはこちら▼https://youtube.com/playlist?list=PLv_EcNe47s5lA4xcySw5mm36n9t5f5xdN00:00 イチローが憧れた男・田尾安志＆イチローを真似した男・岩村明憲02:45 捕手 古田 vs 打者 田尾 現役時代のお互いの印象は？04:18 古田は「怖い大先輩です」と語る 教え子・岩村明憲04:51 左打者の利き手は左右どちらが有利？田尾＆岩村の見解は？07:53 リードする手と落とし込む手 利き手はどちらが良い？10:11 イチローと共鳴する 打席での特徴的なルーティーン11:18 「左手のパワーを殺す」田尾流バットの握り方12:10 「打撃は面で打つ」ヒットメーカー田尾安志が語る打撃の極意15:54 田尾流スタンスは珍しい“逆ハの字” その理由は？19:12 野村克也流 タイプ別 打席での待ち方4タイプとは？22:21 ヤマ張りで鹿取義隆から打った 2本のサヨナラホームラン23:24 恐るべき洞察力 田尾安志の「クセ探し」24:51 安打製造機が打席で待っていたボールは？#田尾安志 #岩村明憲 #プロ野球 ●Twitterhttps://twitter.com/furuta_atsuya27●Instagramhttps://instagram.com/atsuyafuruta?igshid=1qp70xr01hq90●書籍の案内[フルタの方程式(DVD付)] https://amzn.to/2PUFepF[フルタの方程式　バッターズ・バイブル]https://amzn.to/3ek6HKK"
"By2_SOQH9PA","Mrs. GREEN APPLE「フロリジナル」Official Music Video","2022-11-07T15:30:01Z","UCpFgmZm65yOU5X-hmWkWjuw","Mrs. GREEN APPLE","10","22.15.11","[none]","713262","0","0","1406","https://i.ytimg.com/vi/By2_SOQH9PA/default.jpg","False","True","Mrs. GREEN APPLE「フロリジナル」緑が深いこの森を抜けその先の町へ行こうケガは結構してしまっているけど譲れないものはたくさんあるから引き返せやしないひとりがこわいのはみんな一緒どっからか香る救いの共通項を探してみるの誰かの為に明日が来るならそいつが嫌い広い世界だし私のこの悩みはちっぽけだと信じてる「愛してる」なんかもう要らないよ今だけただ抱きしめて欲しい私は嗅ぐ完璧な思いはこの世に無いと貴方を嗅ぐ大切な人に大切にされたい誰かに「ここに居ていいよ」って時間じゃない次元へ行きたい追われる側になれない僕らは欲しがりすぎてるずっとコドクでもいつの日か今までの全部報われると良いんだけど頭ではわかってる寂しさの正体でも今日もまた信じてる「愛してる？」なんてもう聞かないよどうせ居なくなるなら触れないで私は嗅ぐただ断片に。思い出を美しくしていたいから空を嗅ぐ目で見てみないと冒険しないとワクワクが腐るから外へ出たい壮大な景色を想像してる今日も消えちゃいたい夜も私の導火線「愛してる」ならもう聞かないよこの先もずっと抱きしめていて欲しい私は往く また感じた方へただただ信じて そばに居て欲しかった　　　「あぁ 生きてる」なんてそう思えやしないよ今だけ香りに包まって私は知る完璧な思いはこの世に無いと私を嗅ぐ独りじゃないと私を嗅ぐ#MrsGREENAPPLE#フロリジナル#パルファチューン PARFA TUNE（パルファチューン）特設ページ https://fitsonlinestore.com/f/parfatune PARFA TUNE（パルファチューン）は、 FITSが様々なアーティストを迎え入れ、オリジナル楽曲とともにオンリーワンの香水を生みだすコラボプロジェクト。 19世紀にイギリスで発明された「香階」という伝統的な手法をつかって、音を香りで表現します。 香階とは、46種類の香料に、音階を当てはめたもの。揮発性の高い香りは高音に、低い香りは低音に割り当てられ、 和音やオクターブ（高さの違う同じ音）ごとに心地良い香りになるよう設計されています。 19世紀、化学者でもあったイギリスの調香師セプティマス・ピエスによって考案されました。 Supported by FITS CorporationDirector：Kazuki Takahashi(TOKYO management)Director of photography：Daichi Hayashi(TOKYO management)Lighting director ：Haruka Harazawa(TOKYO management)Production designer：Hatsune NakagomiFlower designer：Yoshitaka Mishima（IKKAYA）Offline editor：Yuma MatsuokaOnline editor：Chihiro Hagiwara(Khaki)CGI director：Hiroshi Takeyama(Citro inc.)Colorist：Yusuke Adachi(DIGITAL GARDEN)Stylist：Ippei SogaHair：MiKi MASUEMake up：Miki ParkProduction manager：Chihiro Iida(THINKR) / Mio NakamuraProducer：Kei Terayama(THINKR)Art Director：Yasuha Yajima(jeki)Copywriter：Saki Kobayashi(jeki)Casting：Kentaro Tawara(jeki)Account planner：Asami Oono/Saki Yamaguchi(jeki)Agency：JR East Marketing & Communications,Inc.(jeki)Production：THINKRLyric & Music：Motoki OhmoriArrange： Ryo Hanai, Motoki OhmoriRecording Engineer：Yoshinori Adachi at HeartBeat Recording StudioAssistant：Keita Sasagawa（HeartBeat Recording Studio）Vocal Recording Engineer：Toru Kumade at Submarine STUDIO　Mix Engineer：Yoshinori Adachi at LAB recordersAssistant：Miho Shimizu（LAB recorders）Vocal, Chorus & E. & A. Guitar：Motoki Ohmori E. Guitar：Hiloto WakaiKeyboard：Ryoka FujisawaProgramming：Ryo Hanai, Motoki OhmoriFinger snap, Stapler sound, Pulling and cutting a tape, Tearing paper, Finger snap, Stapler sound, Pulling and cutting a tape, Tearing paper, Cracking knuckles, Clicking a pen, Footsteps, Hitting a garbage can, Crumpling a plastic bag, Opening a bottle cap：Motoki Ohmori10th SingleSoranji2022年11月9日(水)発売1. Soranji        ～映画『ラーゲリより愛を込めて』主題歌～2. 私は最強　    ～『ONE PIECE FILM RED』提供曲セルフカバー～3. フロリジナル　～香りと音のプロジェクト『PARFA TUNE』コラボソング～【初回限定盤CD+DVD】　UPCH-89491　　¥1,980（税込）【通常盤CD】　UPCH-80580　　¥1,320（税込）予約はこちらから → https://lnk.to/mga_soranjiec＊初回限定盤特典①オリジナルスリーブ付き豪華特殊パッケージ②「Soranji」MUSIC VIDEOの世界観を写真で伝える別冊PHOTO BOOK（24ページ）＊初回限定盤特典DVD「Documentary -- Episode 2 “Soranji”」（本作品の制作過程に密着したドキュメンタリー）"
"hSoyv9KP3WY","【不破湊&イブラヒム参戦】マック1万円分食べるまで帰れません！！ #くろなん","2022-11-07T10:00:09Z","UCz6vnIbgiqFT9xUcD6Bp65Q","ChroNoiR","24","22.15.11","chronoir|くろのわーる|クロノワール|葛葉|叶|にじさんじ|nijisanji|VTuber|マック|1万円|不破湊|イブラヒム","971946","0","0","1090","https://i.ytimg.com/vi/hSoyv9KP3WY/default.jpg","False","True","大食いシリーズ…。（叶）　すきやきくいてー（葛葉）チョコパイうますぎ（不破湊）　マックおいし〜w（イブラヒム）くろなんでマクドナルド1万円企画！初ゲスト不破湊とイブラヒムが、助っ人として参加！お腹いっぱい食べながら、ろふまお塾やにじバラなど番組の裏話で盛り上がる4人。大食いイメージからかけ離れたメンツで挑むこの企画、無事終わることができるのか…！？ゲスト@不破 湊 / Fuwa Minato【にじさんじ】 @イブラヒム【にじさんじ】 - - - - - くろのわーるがなんかやる - - - - -くろのわの2人でゆる～くやりたいことをやる番組。ChroNoiRチャンネルにて毎週月曜日19：00に放送します。番組感想は #くろなん でお願いします！- - - - - ChroNoiR | クロノワール - - - - -にじさんじ所属バーチャルライバー叶 と 葛葉 のユニットチャンネル◇ Kanae | 叶@Kanae Channel Twitter: https://twitter.com/Kanae_2434◆ Kuzuha | 葛葉@Kuzuha Channel Twitter: https://twitter.com/Vamp_Kuzu- - - - - - - - - -ChroNoiR SNS - - - - - - - - - - Twitter：https://twitter.com/chronoir_infoTikTok：https://www.tiktok.com/@chronoir_infoInstagram：https://www.instagram.com/chronoir_info/※未成年者の視聴者の方は、下記リンク先の注意事項もご覧ください。https://www.anycolor.co.jp/notice-for-minors"
"z35OUyNYqr0","だるまさんがころんだサバイバルがミニゲームに！？【マインクラフト】","2022-11-08T08:30:16Z","UCh7bThzNArch6TgoHB1HVhA","カラフルピーチ","20","22.15.11","マイクラ|まいくら|マインクラフト|minecraft|からぴち|カラフルピーチ|じゃぱぱ|たっつん|のあ|なおきり|ゆあん|えと|ヒロ|うり|どぬく|もふ|シヴァ|るな","874422","0","0","2013","https://i.ytimg.com/vi/z35OUyNYqr0/default.jpg","False","True","この動画で紹介しただるまワールドはマーケットプレイスから購入可能！https://www.minecraft.net/ja-jp/marketplace/pdp?id=7accec52-061f-4a3f-83a7-86f8a2b8fc39みんなプレイしてね！ついに！！カラフルピーチの初グッズ登場Tシャツ、タオル、キーホルダーですかわいいグッズがいっぱい▼気になった方はこちらのサイトから購入してね！https://muuu.com/collections/ondemand-3254-3930🍑からぴち公式Twitter ➡︎ TwitterのURL🔴https://twitter.com/official_clpc↑のフォロー欄からメンバーのTwitterもフォロー出来ます！#からぴち で呟くとメンバーからメッセージか貰えたり……？？？🍑からぴちメンバー🍑じゃぱぱ／のあ／ゆあん／たっつん／シヴァ／どぬく／うり／えと／ヒロ／なおきり／もふ／るな個性豊かな12人の新グループ実況………からぴちこれからどんどん活動していきます🍑🍑🍑🍑動画について📷＿＿＿ ↓📄素画像材・PIXTA〜🎵音源＆効果音🎵〜🎷魔王魂・URL🔴http://maoudamashii.jokersounds.com/🎷効果音ラボ・URL🔴http://soundeffect-lab.info/🎷DOVA-SYNDROME・URL🔴http://dova-s.jp/🎷Epidemic Sound・URL🔴http://www.epidemicsound.com🎷Music is VFR・URL🔴http://musicisvfr.com/free/license.html※動画によって使用していない場合がございます。#からぴち　 #マイクラ　#まいくら"
"Lz1kIpfz1kM","【ブタメン撮影後】この中で1人地獄みます。","2022-11-08T11:00:16Z","UC8_0F0bInj6PJr5WW1S1b4Q","深夜のレイクレ","20","22.15.11","[none]","198138","0","0","336","https://i.ytimg.com/vi/Lz1kIpfz1kM/default.jpg","False","True","＃レイクレ＃面白かったらいいね＃チャンネル登録よろしく☆ブタメン本編はこちら↓【激うま】ブタメンに食材追加して本格ラーメン作ったら店出すことなりましたwwwhttps://youtu.be/AckhFPXhkNE#レイクレ天下統一も投稿よろしくな！■レイクレ天下統一についてレイクレYouTubeの切り抜き動画に「#レイクレ天下統一」をつけてTikTokに投稿！その月に1番いいね数が多かった人の夢を叶えます！※今回からは「#レイクレしか勝たん」のみの投稿は対象外になるので注意⚠️レイクレ天下統一の動画はこちら↓https://youtu.be/F8MHU1ID-70エンディング↓https://youtu.be/-nuCJRN1YDo個人チャンネルもよろしくな！！どば師匠https://www.youtube.com/channel/UCo_ZEnlx-n5uJKxgxLTcs8wてっちゃんhttps://www.youtube.com/channel/UCU01YcrQlhkviS-U6OfcqRQともやんhttps://www.youtube.com/channel/UCjq5kACCh5V056h3BoONBUAお仕事はこちらまで↓↓↓info@sai-oh.jpレイクレサブhttps://www.youtube.com/channel/UC8_0F0bInj6PJr5WW1S1b4Qチャンネル登録よろしくな！！https://www.youtube.com/channel/UCP-3.TwitterLazy Lie Crazy https://twitter.com/lie_lazyどば師匠 https://twitter.com/lazy_dobaたかし https://twitter.com/t_kashi_dayoともやん https://twitter.com/tmyndayoてっちゃん https://twitter.com/llc_tecchanぺろ愛男爵 https://twitter.com/peroaidanshaku1インスタどば師匠http://instagram.com/lazy_doba/たかしhttps://www.instagram.com/t_kashi_dayoてっちゃんhttps://www.instagram.com/tttigrisx/ともやんhttp://instagram.com/tmyndayo/ぺろ愛男爵https://instagram.com/peroai/TwitterLazy Lie Crazy https://twitter.com/lie_lazyどば師匠 https://twitter.com/lazy_dobaたかし https://twitter.com/t_kashi_dayoともやん https://twitter.com/tmyndayoてっちゃん https://twitter.com/llc_tecchanぺろ愛男爵 https://twitter.com/peroaidanshaku1インスタどば師匠http://instagram.com/lazy_doba/たかしhttps://www.instagram.com/t_kashi_dayoてっちゃんhttps://www.instagram.com/tttigrisx/ともやんhttp://instagram.com/tmyndayo/ぺろ愛男爵https://instagram.com/peroai/"
"lV_0sbbuINU","今後について正直な気持ちを語ってみた。","2022-11-09T10:00:28Z","UCpR-DYTq7u9ELBbps4KQLcw","こめおチャンネル","22","22.15.11","ブレイキングダウン|こめお|朝倉未来","398552","0","0","3136","https://i.ytimg.com/vi/lV_0sbbuINU/default.jpg","False","True","チャンネル登録、グッドボタン、各種SNSフォローお願いします。スポンサー、仕事の依頼はこちらにご連絡ください。comeo.bussines@gmail.com食事会の案内はこちらから↓ ↓ ↓公式LINEhttps://lin.ee/AQ8l1FQTwitter https://twitter.com/komeo1144instagramhttps://www.instagram.com/comeo_comel...Tiktokhttps://vt.tiktok.com/ZSdNojMw2/スポンサー　蓮工業https://www.hasu-kogyo.co.jp/#こめお #BreakingDown #朝倉海 #朝倉未来 #瓜田純士 ＃格闘技 #MMA #キックボクシング #料理人 #ブレイキングダウン  #breakingdown6   #RIZIN #ブレイキングダウン6"
"y_hjyqYipVc","捕獲した子猫ちゃんたちについてママさんと真剣に相談しました。先に引っ越ししたクロ＆シロちゃんの近況報告も！","2022-11-08T11:00:40Z","UCUYk7t7glHFqIZ3rwN1dY6A","坂上家のチャンネル","15","22.15.11","[none]","512304","0","0","225","https://i.ytimg.com/vi/y_hjyqYipVc/default.jpg","False","True","▼続きの動画はこちら！▼https://youtu.be/Z7sKvwXMAKc『懐かない子猫ちゃんがついにさかがみ家へ！馴染むことはできるのか？？兄弟ニャンコともご対面！』▼野良猫の子猫ちゃんを保護　～パパ勉強中～　のアーカイブはこちら！▼『野良の子猫の捕獲作業に初挑戦！保護活動の本格始動です』https://youtu.be/nOXQNb2oEnk『【悪戦苦闘】捕獲作業で坂上忍が辛い選択を迫られる』https://youtu.be/8lcTR2FPCPI『ママさんが落ち込む。保護した子猫が坂上家に馴染んでくれない』https://youtu.be/kD_yoqPq3yo『捕獲した子猫がさかがみ家へお引越し！ニャンコたちの反応は？？嘉門がメロメロになりすぎておかしくなります』https://youtu.be/R5bzic5GPME４匹の子猫を捕獲するところから保護に挑戦する坂上パパ最初の２匹は無事にさかがみ家に引っ越しすることができたしかし、残りの２匹が中々馴染んでくれず、さかがみ家への引っ越しを迷っていた。子猫をどうするのか？ついにある決断をします。どうぞご覧ください。次回は１１月１１日（金）よる８時に更新します！是非お楽しみに！－－－－－－－－－－スペックチップ版でも２５兄弟の映像を公開中！https://spectip.com/channel/VLxshJTWqCM56axz最新投稿『お庭でパパと遊ぼう！みんなパパが大好き！』→『Thanks！』をクリックすると、一切編集を加えていないYouTubeの素材映像をご覧いただけます！（坂上パパが撮影したそのままの状態の映像をご覧いただけます！）よりリアルな坂上家の日常を是非お楽しみください！－－－－－－－－－－よろしければ「坂上家のチャンネル」のチャンネル登録をお願いします！ https://www.youtube.com/channel/UCUYk7t7glHFqIZ3rwN1dY6A坂上忍 オフィシャルブログhttps://ameblo.jp/shinobu-sakagami/YouTube「さかがみ家のチャンネル」（保護ハウス）https://www.youtube.com/channel/UC3Q-ctEYeOlYMECGzGBSrIgさかがみ家 オフィシャルホームページ（保護ハウス）《「さかがみ家」の里親募集・Ｔシャツなどのグッズ購入はこちら》https://sakagamike.com/さかがみ家 オフィシャルブログ（保護ハウス）https://ameblo.jp/sakagamikeさかがみ家 インスタグラム（保護ハウス）https://www.instagram.com/sakagamike_official/坂上どうぶつ王国https://www.fujitv.co.jp/sakagamidoubutsu/坂上どうぶつ王国 Twitterhttps://mobile.twitter.com/s_doubutsu坂上どうぶつ王国 Instagramhttps://www.instagram.com/sakagami_doubutsu/坂上忍が総合プロデュースするタレント事務所＆スクール『アヴァンセ』※所属タレントを募集中！（演技レッスンは他事務所所属者の方も受講できます！）https://avance-pro.com/YouTube関連の仕事依頼の問い合わせ先sakagamikeno@gmail.com#坂上忍 #野良猫 #保護猫 #cats #さかがみ家 #坂上家 #かわいい犬 #かわいい猫 #cutedogs #cutecats #保護犬　#dogs"
