video_id,title,publishedAt,channelId,channelTitle,categoryId,trending_date,tags,view_count,likes,dislikes,comment_count,thumbnail_link,comments_disabled,ratings_disabled,description
"IlNROOF_U0E","【昼】にじさんじライバーの嫌いな食べ物だけで１日過ごします【VS葛葉】","2022-11-14T11:00:08Z","UCD-miitqNY3nyukJ4Fnf4_A","月ノ美兎","24","22.15.11","にじさんじ|nijisanji|Vtuber|月ノ美兎|つきのみと|tsukinomito","770666","0","0","1607","https://i.ytimg.com/vi/IlNROOF_U0E/default.jpg","False","True","朝編→https://www.youtube.com/watch?v=_PjwFzplPrg〇参考にさせていただいた動画Youtuberの嫌いな食べ物だけで1日過ごしてみたwwhttps://www.youtube.com/watch?v=1Ziz0tTxQNg【過酷】Youtuberの嫌いな食べ物で1日過ごしてみたwwhttps://www.youtube.com/watch?v=ZF7wuLljtS4@パパラピーズ 〇参加していただいたライバーさん方@ジョー・力一 Joe Rikiichi @Vox Akuma【NIJISANJI EN】 @オリバー・エバンス / Oliver Evans 【にじさんじ】 @ニュイ・ソシエール //[Nui Sociere] ・闘った@Kuzuha Channel"
"5Y_rYxfzPUk","朝倉未来にケジメつけてきた","2022-11-14T10:00:09Z","UCzpy_vsj84oQL_fR0Fr1g0A","仲村TV","24","22.15.11","朝倉未来|ばん中村|バン仲村|バン中村","561925","0","0","669","https://i.ytimg.com/vi/5Y_rYxfzPUk/default.jpg","False","True","朝倉未来さんとコラボした動画はこちら↓https://youtu.be/BSxI37Mn_6Q★バン仲村『ずっと夏だから…』https://linkco.re/FvPh6y4v毎週絶賛更新中、バン仲村の漢気溢れる情熱バラエティー仲村TVコメント高評価チャンネル登録是非とも宜しくお願いします！！＝＝＝＝＝★バン仲村公式ラインスタンプ販売中！！https://store.line.me/stickershop/product/20754889/ja　★〚仲村の流儀〛サブチャンはじめます。チャンネル登録よろしくお願いします！https://www.youtube.com/channel/UCtv9WXW6jUYibLQdadP5OZw★ ケンカバトルロワイアル　https://www.youtube.com/channel/UCCDxgj6AtIRL5LqhbV1imrgケンカバトルロワイアルシーズン３参加者募集中👇https://slumhoodstar.localinfo.jp/pages/6324159/page_202208090715ケンカバトルロワイアル公式情報はコチラ👇https://twitter.com/STBR2022-------------------------------------☆バン仲村SNS☆公式ライン始めました☆https://lin.ee/jJjnWxBInstagramインスタライブ不定期開催中https://www.instagram.com/lounge8989Twitterhttps://twitter.com/nakamura_tvtvTikTok(暴露、実話、ウラ話系）https://vt.tiktok.com/ZSd23WA3q/TikTok（ダンス系）https://vt.tiktok.com/ZSdjXVDUE/〚お仕事・コラボのご依頼はマネージャーまで〛Mail : daichikikuip@gmail.comTwitter：https://twitter.com/creatorworks8Instagram：https://instagram.com/kikui_producer〚マネージャー菊井のチャンネルはこちら〛https://youtu.be/E-AWK7XWpc8 #バン仲村　#仲村tv　#朝倉未来 #ブレイキングダウン"
"DxbeXHaub1c","スプラトゥーン3 2022冬 Chill Season","2022-11-14T14:00:13Z","UCkH3CcMfqww9RsZvPRPkAJA","Nintendo 公式チャンネル","20","22.15.11","Game|VideoGame|ゲーム|ビデオゲーム|Video Game (Industry)|任天堂|ニンテンドー|Nintendo|sv_nintendo|Switch|スイッチ|Splatoon|スプラ|スプラ3|イカ|タコ|ナワバリバトル|サーモンラン|ビッグラン","1604864","0","0","0","https://i.ytimg.com/vi/DxbeXHaub1c/default.jpg","True","True","【ウェブサイト】https://www.nintendo.co.jp/switch/av5ja/index.html【再生リスト:Nintendo Switch】https://www.youtube.com/playlist?list=PLPh3p_yYrx0Czy6UCWAg3ZKcCdyt0ztdR動画に含まれる情報は公開日時点のものです。"
"vvXqFeOjLkU","【TMT狩り】試合を終えてメイウェザーと進展が!!","2022-11-14T15:37:50Z","UC5o11UDNha6m1yoL_IJGYPQ","皇治チャンネル","24","22.15.11","皇治|こうじ|YouTube|ユーチューブ|ユーチューバー|YouTuber|格闘技|皇治チャンネル|ごぼうの党|奥野|レペゼン|キックボクシング|ボクシング|ブレイキングダウン|こめお|ライジン|超RIZIN|メイウェザー|西山茉希|3150|RIZIN|K-1|RIZIN34|ヒカキン|青木真也|アベマ|亀田|亀田京之介|スパシャン|筋トレ|パピブル|フレンチブルドッグ|ダイエット|大食い|はじめ社長|ヒカル|朝倉|ガードマン|スカイピース|コムドット|へらへら|ヘラヘラ|ヘラヘラ三銃士|亀田興毅|内山高志|HEAT|魔裟斗|安保瑠輝也|平本蓮|朝倉未来|朝倉海|シバター|那須川天心|江頭|竹原|畑山|渡嘉敷|武尊|竹原チャンネル|チビみらん|望蘭|宮迫|喧嘩自慢|MMA|HEAT50|ノビテック|ランボルギーニ|ザマッチ2022|thematch|皇治TV|東海オンエア|ハゲ|焼肉|BAR|TEAMONE|TikTok|ポイ捨て|ぼったくり|カジサック|ゆたぼん|スーパースター|進撃のノア|喧嘩|ハニートラップ|重課金|クラウドファンディング|記者会見|天心|コラボ|ヒロキング","290449","0","0","828","https://i.ytimg.com/vi/vvXqFeOjLkU/default.jpg","False","True","皇治ウェアプレゼント企画応募🔻インスタグラム（ストーリー）or Twitterに皇治&チームワンをタグ付けして投稿🎵抽選で1名様にプレゼント🎁当選された方のみスタッフよりご連絡させていただきます❗️------------------------------------------------------------------------------------------------------YouTube案件・ｽﾎﾟﾝｻｰのご依頼はコチラまで🔻team.one1.info@gmail.com 所属 / TEAM ONEメディアマネジメント / BBEhttps://bbe.co.jp/profile/kouzi/【皇治TV】YouTubeサブチャンネルhttps://youtu.be/hP-z2tMzgvE【「NowVoice」トップランナー】皇治　RIZIN.成り上がり・NowVoice参画!!https://twitter.com/nowvoice_jp/status/1332112072587427842?s=29【MADBRO】新作発売！私服・香水皇治アパレルブランドhttps://www.madbro.jp/【BODYMAKER×皇治】トレーニングウェアhttps://www.bodymaker.jp/shop/e/ekouzi/【AWESOME×皇治】ｽﾏﾎｹｰｽ　ｷｰｹｰｽ　ﾊﾟｰｶｰ　小物入れ　などhttps://item.rakuten.co.jp/awesome-japan/c/0000000376/【AbemaTV ×皇治】ｵﾘｼﾞﾅﾙﾏｽｸhttps://www.abemashopping.jp/kouzi-originalmask/皇治　SNS ▼【Intagram】1_kouzi https://www.instagram.com/1_kouzi/#皇治 #メイウェザー #YouTube #皇治チャンネル #RIZIN #キックボクシング #tmt #mayweather"
"aqW4xXUgmno","[CHOREOGRAPHY] BTS (방탄소년단) '달려라 방탄 (Run BTS)' Dance Practice","2022-11-13T10:00:02Z","UCLkAepWjdylmXSltofFvsYQ","BANGTANTV","10","22.15.11","방탄소년단|BTS|BANGTAN|알엠|RM|슈가|SUGA|제이홉|jhope|지민|정국|k-pop|방탄|j-hope|Jung Kook|Jimin|BTS V|Jin","13679100","0","0","84388","https://i.ytimg.com/vi/aqW4xXUgmno/default.jpg","False","True","#BTS #방탄소년단 #달려라방탄 #RunBTS Connect with BTS: https://ibighit.com/bts http://twitter.com/BTS_bighithttp://twitter.com/BTS_twt http://www.facebook.com/bangtan.official https://www.youtube.com/user/BANGTANTV http://instagram.com/BTS.bighitofficial https://channels.vlive.tv/FE619 https://www.tiktok.com/@bts_official_bighithttps://weverse.onelink.me/qt3S/94808190https://www.weibo.com/BTSbighithttps://www.weibo.com/BTSmembers http://btsblog.ibighit.com"
"xTcFdTnZY_Y","【WINNER'S VS 大成高校｜試合フル】全員に与えられたチャンス。一度負けた相手へ成長した姿を見せつけろ","2022-11-14T09:00:10Z","UCCkQD7wgH7F5vGWeFieSqfQ","eFootball チャンネル","17","22.15.11","KONAMI|ウイイレ|eFootball|Winner's|ウィナーズ|サッカー|ウイニングイレブン2021","388378","0","0","1515","https://i.ytimg.com/vi/xTcFdTnZY_Y/default.jpg","False","True","▼モバイル版 eFootball™ 2023のインストールはこちらから！！！https://konami.jp/3PvsTBv ▼eFootball™ 2023の情報はこちらから！！https://konami.jp/3kNWIk5#eFootball  #ウィナーズ運命の3連戦の第2戦は大成高校！総力戦で勝利とWINNER'Sの席を掴み取れ！前回対戦では敗北を喫した相手に成長を見せつける事ができるのか。「日本で1番見られるサッカーチーム」へ、これからも応援よろしくお願いします！GO！WINNER’S！GO！▼アンケートのご協力をお願いします。https://questant.jp/q/WINNERS_01今後のWINNER'Sを決めるのは視聴者の方一人ひとりの一票です。貴重なご意見を何卒宜しくお願い致します。▼出演・那須大亮 / Daisuke Nasuhttps://www.youtube.com/c/%E9%82%A3%E9%A0%88%E5%A4%A7%E4%BA%AEDaisukeNasu・ウンパルンパチューブhttps://www.youtube.com/channel/UCFdM9GtQ7MlIuFUey2nsk3A・リゼム LISEM CHANNELhttps://www.youtube.com/c/lisemchannel・ばんばんざいhttps://www.youtube.com/channel/UCBKqbSl9bK_ln9zZ-C5rP0Q・かけまるチャンネルhttps://www.youtube.com/channel/UC-7C8c-SOAQ_X8kLBVQSclw・あゆむ【0からチームを作る物語】https://www.youtube.com/channel/UCLt_KREQ42w2fTwlK2n1dFw・Channel MAKIHIKAhttps://www.youtube.com/c/ChannelMAKIHIKA・うめうめチャンネルhttps://www.youtube.com/channel/UCU8Nq7pZr7WPQ0w5jxEuS6g・REGATEドリブル塾https://www.youtube.com/c/REGATE%E3%83%89%E3%83%AA%E3%83%96%E3%83%AB%E5%A1%BE・若田和樹 GiantKazukihttps://www.youtube.com/channel/UC6EVKFK7OJYCTIoQMe0vdBg・まっすーの日常https://www.youtube.com/channel/UCdKrt3LChW-e058JyHmSb5g・あざこじチャンネルhttps://www.youtube.com/channel/UCIx0LBBLreOTUXQqYzjOpEQ・じゅんやのvlog【Winner's】https://www.youtube.com/channel/UCBRvVChn9VqcltQwqfD887w/featured・あいchannelhttps://www.youtube.com/channel/UCd3eRqp-1-L7FJ-LJRYvyLA・AK1NORIちゃんねるhttps://www.youtube.com/channel/UCLtfIaTXq_wKBtYcmxXy9mg・内藤秀明の分析チャンネルhttps://www.youtube.com/channel/UCUqWyN9txseCK55qhqxPddA・地方住み医大生みさきhttps://www.youtube.com/channel/UCRNlwqet6WObJ7RSAYp5Tqw【Season 1】https://youtube.com/playlist?list=PLmeoXS8aq72kGvsmL0_qx0ONx6cFn2yls【Season 2】https://youtube.com/playlist?list=PLmeoXS8aq72mFfYryM-9sQyAwPxhHaKL6【Season 3】https://youtube.com/playlist?list=PLmeoXS8aq72lbk0dpLWpnhdfq9vZvtr7p【Season 4】https://youtube.com/playlist?list=PLmeoXS8aq72lhxPmM2V81MmD1xR-6G1jX【Season 5】https://youtube.com/playlist?list=PLmeoXS8aq72n4LbDjFrmc4H7hwK7Ybl0T▼eFootball™公式サイトhttps://www.konami.com/efootball/ja/▼eFootball™公式Twitterhttps://twitter.com/we_konami▼eFootball™公式Instagramhttps://www.instagram.com/efootball_official_jp/channel/▼eFootball™公式TikTokhttps://www.tiktok.com/@official_efootball▼eFootballhttps://www.youtube.com/play_efootball企画・制作：株式会社LuaaZ提供：KONAMI"
"JjTJT07_YJY","【超豪華ゲスト】黄色のYouTuber集めて旅行に行ったら最高な1日になったwww","2022-11-14T10:34:00Z","UCf2cN9o0ndPwqA3wZLFj_NQ","ESPOIR TRIBE-エスポワール•トライブ-","24","22.15.11","桐崎栄二|きりざきえいじ|宇陀|エスポワール|けーすけ|島袋|youtuber|UUUM|エスポワールTRIBE|桐崎親父|はんくん|ドッキリ|対決|耐久|検証|大食い|やってみた|爆笑|お笑い|面白|石川県|ひろと|東京|日常|埼玉県|大阪府|兵庫県|ガチヤマ|エスポ|ESPOIR|ESPOIRTRIBE|新世代|グループ|歌ってみた|企画","468953","0","0","1092","https://i.ytimg.com/vi/JjTJT07_YJY/default.jpg","False","True","【今回ご参加頂いたクリエイターの皆様】ンダホさん　@Fischer's-フィッシャーズ- じんたん　　@スカイピース ぎし　　　　@ばんばんざい おまけ　　　@ぎしだけです 撮影協力：龍宮城スパホテル三日月http://www.mikazuki.co.jp/ryugu/という事でメンバーカラーウィーク一発目は黄色でした😆‼️奇跡的によくプライベートで会う3人に！！僕の大好きな先輩、友達、後輩です☺️この日の出来事は、後日当分余韻に浸れるくらい楽しかったなあ〜。また来年もこのメンバーで旅に行きたいです😌黄色、さいこおおおおおおおおお！！！！けーすけさぶちゃんねる(エスポワール休憩所）↓↓↓https://www.youtube.com/channel/UC8DEmCFZcUEAb8gc0Hng79w【僕たちのヘアケアブランドEXGEE(エグジー）販売中！！！】■ EXGEE公式Instagram ： https://www.instagram.com/exgee_official/■ EXGEE公式オンラインストア：https://exgee.jp/■ ヘアサロン「AKROS」公式サイト：https://akros-no1.com/エンディング曲【ESPOIR TRIBE SPECIAL DUB/CHEHON&NATURAL WEAPON】↓↓↓https://www.youtube.com/watch?v=vqNtLYtU_8sチャンネル登録、高評価宜しくお願いします！！【Twitter】けーすけ　http://twitter.com/@KEESUKE_ESPOIR島袋            http://twitter.com/@Agovukuroはんくん    http://twitter.com/@hankunESPひろと　　http://twitter.com/@Hiroto_espoirガチヤマ　http://twitter.com/@GATIYAMA_ESP【instagram】けーすけ  http://instagram.com/keisuke.espoir_tribe島袋　　   http://instagram.com/agovukuroはんくん   http://instagram.com/esp_hankunひろと       http://instagram.com/esp.hiroガチヤマ   http://instagram.com/esp.gatiyama《プレゼント、ファンレター等の送り先はこちら！！》〒107-6228東京都港区赤坂9丁目7番1号ミッドタウンタワー28FUUUM株式会社 エスポワールTRIBE 宛お仕事のご依頼はこちら↓↓https://www.uuum.co.jp/inquiry_promotion【ESPロンT 発売中！！！】サイズS.M.L.XL 各4000円(税込)MUUUにてエスポワールロンT発売！！https://muuu.com/videos/48ad8257c3c8cd8f【音源・効果音使用元】様―DOVA-SYNDROME■http://dova-s.jp/―効果音ラボ■http://soundeffect-lab.info/―甘茶の音楽工房■http://amachamusic.chagasi.com/素材提供 PIXTA※動画によって使用していない場合がございます。#エスポワールTRIBE#ESPOIRTRIBE"
"r5gWlq20GQg","【1年半ぶり】兄妹撮影中にコムドットが隣の席で変装してたらいつ気付く⁉︎【ドッキリ】","2022-11-13T12:00:11Z","UCpbu18sbRQlFSo1PtixzktQ","中町兄妹","24","22.15.11","中町jp|中町綾|中町|中町兄妹|tiktok|兄妹","1139952","0","0","1327","https://i.ytimg.com/vi/r5gWlq20GQg/default.jpg","False","True","@コムドット 撮影協力：https://29takeda.com/皆さんお待たせしました！待たせすぎたかもしれません！！最後の中町兄妹とコムドットのコラボから約1年8ヶ月が経ちました。皆んなからの、寂しい、悲しい、もう一回見たい、ちゃんと僕達には届いてました。沢山待たせてしまいごめんなさい。今回やまと貸し出し企画でやまとから声を掛けてもらい、久しぶりの『あややま』が見れる事になりました！やまと、コムドットありがとう！そして今、コムドット×スカイピース×カジサックさんの3組主催のチャンネル登録者数球技大会に参加してます！僕達のチームはカジサックさんのサル軍です！↓サル軍のメンバーがこちらです@カジサック KAJISAC @くれいじーまぐねっと CrazyMagnet @もーりー【アホと弟】 チャンネル登録を是非宜しくお願い致します！！！今日も動画を見てくれてありがとう！■スキンケアブランド『ASUNE』・公式WEBサイト：https://asune.jp/・公式Instagram：https://www.instagram.com/asune_official/・公式LINE：https://lin.ee/4fltcYI■アパレルブランド『JUST A NOON』・公式WEBサイト：https://justanoon.jp・公式Instagram：https://instagram.com/justanoon_official・公式LINE：https://line.me/R/ti/p/%40117ymmjr・公式Twitter：https://twitter.com/justanoon_■中町兄妹LINEスタンプ第一弾https://line.me/S/sticker/17023106そうです、一般人の代表中町兄妹です。チャンネル登録/高評価/コメントお願いします！！！中町JP（兄）と中町綾（妹）のSNSもフォローお願いします♪⚫︎中町純平のマジ酔ってるわ‼︎https://www.youtube.com/channel/UCp7GNebwQ2z8coZ4wV5_Eiw⚫︎中町綾https://www.youtube.com/c/ayasabu⚫︎Instagram∟兄 http://Instagram.com/demichenakamachi ∟妹 https://www.instagram.com/ayanakamachi/?hl=ja ⚫︎Twitter∟兄 https://mobile.twitter.com/demichenakamach∟妹 https://twitter.com/aya110n_n ⚫︎TikTok∟兄妹 https://vt.tiktok.com/ADxSjG/∟兄 https://vt.tiktok.com/ADXndw/ ∟妹  https://vt.tiktok.com/ZSun5PeD/⚫︎中町JPの会社∟株式会社トキメキクリエイト http://tokimekicreate.jp/ お問い合わせ 【info@tokimekicreate.jp】"
"jRZxGYKHqsE","最終決戦！ダイマ禁止、使用率トップ150禁止！【ポケモン剣盾】【ゆっくり実況】","2022-11-14T11:00:34Z","UCymUFlFt2gKlaCu0RRVYhDA","エルトライト","20","22.15.11","ポケモン|剣盾|バンビー|エルトライト|ゆっくり|実況|アーケオス|ライチュウ|テブリム|シャワーズ|トルネロス|フーディン|イエッサン","158398","0","0","426","https://i.ytimg.com/vi/jRZxGYKHqsE/default.jpg","False","True","剣盾ありがとう！新時代が楽しみすぎる！編集遅れて投稿延期を許してくれたバンビーさんは神ですバンビーさん視点↓https://www.youtube.com/watch?v=o_xaKnhdC-U@バンビー チャンネル登録されると喜びます～■Twitter : @elepokemon※この動画は東方Projectをもとにした二次創作です。使用したポケモンイエッサン♀：ずぶといHBフーディン：臆病CSトルネロス：無邪気CSアーケオス：無邪気ASシャワーズ：呑気HBテブリム：呑気HB【前回の動画】https://www.youtube.com/watch?v=DTi4vbuEF14【ポケモン剣盾再生リスト】https://www.youtube.com/watch?v=-rdqAlYylLQ&list=PLfDoPNXa-g8【ポケモンBDSP再生リスト】https://www.youtube.com/playlist?list=PLfDoPNXa-g8TA-3j8Xh0CPtPbDi-rY7o_【ポケモンUSUM再生リスト】https://www.youtube.com/watch?v=e17BkcCtfF8&list=PLfDoPNXa-g8Snlk6aBHu1PC21vuhpPEM8#ポケモン剣盾#ゆっくり実況#エルトライト使用素材：OtoLogic、music is VFR"
"4CGxAqaRy2I","次は僕の進化の番か・・・【ポケモン剣盾】【ゆっくり実況】","2022-11-14T11:15:00Z","UCu0HaR1uI4R8gbdHnd5GWAQ","ぽへチャンネル","20","22.15.11","ポケモン|ポケモン剣盾|ソードシールド|ぽへ|ぽへチャンネル|ゆっくり|ゆっくり実況|マッシブーン|霊夢|魔理沙|任天堂|ゲーム|ゲーム実況|ソード|シールド|ランクマ|人気|ダイマックス|DLC|鎧の孤島|キョダイマックス|冠の雪原|伝説|冠|ポリ2|でんせつ|ダイパ|ポケモンBDSP|リメイク|ポリゴン2|レジェンズ|ポケモンSV|ヘラクロス","283429","0","0","584","https://i.ytimg.com/vi/4CGxAqaRy2I/default.jpg","False","True","お前はメガシンカしたやろがい■Twitter→https://twitter.com/pohe_poke■サブチャンネル→https://www.youtube.com/channel/UCETtGOQeHRwD1QpxR-7Eveg/videos■ED曲「Ceiling Star」chair/ちぇあさんのサイト…https://kuusouriron.com/※この動画は【東方project】を基にした二次創作です。東方Projectの二次創作ガイドラインhttps://touhou-project.news/guideline/■BGM、効果音提供サイト(一部抜粋)・魔王魂…http://maoudamashii.jokersounds.com/・ニコニ・コモンズ…http://commons.nicovideo.jp/・MusMus…http://musmus.main.jp/・甘茶の音楽工房…http://amachamusic.chagasi.com/・フリー音楽素材 H/MIX GALLERY…http://www.hmix.net/#ポケモン　#ポケモン剣盾　#ゆっくり実況"
"HbjdHP1e6zw","BreakingDown6試合の裏側・飯田将成に怒られたポーランド人？【前編】","2022-11-14T10:30:11Z","UCVXeirblKAiR9ZEkBo2KwiA","ポーランドの刺客 → Pawel Natsuki","17","22.15.11","BreakingDown6|飯田将成|ポーランドの刺客|SATORU","195119","0","0","271","https://i.ytimg.com/vi/HbjdHP1e6zw/default.jpg","False","True","２０２２年１１月３日　→　BreakingDown初参戦！　その裏側ご覧ください応援ありがとうございました！これからもっともっと強い姿を見せれるように頑張る！登録もよろしくお願いします！m(__)mー－－－－－－－－－－－－－－－－－－－－－－－－オリンプのサプリメントを飲んでみたい方への割引クーポンどうぞ！https://coupon.rakuten.co.jp/getCoupon?getkey=MkFINS1CWkZQLUdLS1QtS0s1Wg--&rt=ー－－－－－－－－－－－－－－－－－－－－－－－－Instagram：https://www.instagram.com/pawel_natsuki/Twitter：https://twitter.com/pawel_natsukiTikTok:https://www.tiktok.com/@pawel_natsuki■お仕事のご依頼はこちらc.pawel@c-chord.comーーーーーーーーーーーーーーーーーーーーーー飯田将成↓https://www.youtube.com/user/bushin138せりな【格闘家】↓https://www.youtube.com/channel/UCHLq9zwjFBuUdSdg0yeqnUw醤油ニキ↓https://www.youtube.com/channel/UCfjy6RiGiTGG0xxPo-UXVfA平石光一チャンネルhttps://www.youtube.com/channel/UCFY0C14EvSXeiWQid_qZvgwとぅよいよ川島悠汰　Yuta Kawashimahttps://www.youtube.com/channel/UCMoew199gqj_oZsPCa6D85Aーーーーーーーーーーーーーーーーーーーーーー#ブレイキングダウン #ポーランド #satoru #breakingdown6 #breakingdown #朝倉未来 #勾配ニキ#飯田将成#青汁王子#飯田さん#てる#ジョリー#エド#こめお"
"o6jDRryl5vA","【葛葉生誕祭2022】プレゼントを賭けて真剣勝負のはずがまさかの大爆笑！？ #くろなん","2022-11-14T10:00:09Z","UCz6vnIbgiqFT9xUcD6Bp65Q","ChroNoiR","24","22.15.11","chronoir|くろのわーる|クロノワール|葛葉|叶|にじさんじ|nijisanji|VTuber|生誕祭|HB|誕生日|Happy Birthday","230435","0","0","310","https://i.ytimg.com/vi/o6jDRryl5vA/default.jpg","False","True","めでたいね。（叶）　たんじよう（葛葉）お待たせしました！葛葉誕生日企画！！叶が用意した本気すぎるプレゼントの中身を大公開！プレゼント獲得のため、あの手この手で勝負に挑む葛葉。無事ゲットすることはできるのか!?- - - - - くろのわーるがなんかやる - - - - -くろのわの2人でゆる～くやりたいことをやる番組。ChroNoiRチャンネルにて毎週月曜日19：00に放送します。番組感想は #くろなん でお願いします！- - - - - ChroNoiR | クロノワール - - - - -にじさんじ所属バーチャルライバー叶 と 葛葉 のユニットチャンネル◇ Kanae | 叶@Kanae Channel Twitter: https://twitter.com/Kanae_2434◆ Kuzuha | 葛葉@Kuzuha Channel Twitter: https://twitter.com/Vamp_Kuzu- - - - - - - - - -ChroNoiR SNS - - - - - - - - - - Twitter：https://twitter.com/chronoir_infoTikTok：https://www.tiktok.com/@chronoir_infoInstagram：https://www.instagram.com/chronoir_info/※未成年者の視聴者の方は、下記リンク先の注意事項もご覧ください。https://www.anycolor.co.jp/notice-for-minors"
