video_id,title,publishedAt,channelId,channelTitle,categoryId,trending_date,tags,view_count,likes,dislikes,comment_count,thumbnail_link,comments_disabled,ratings_disabled,description
"FUIz7FPBgC8","HERE WE GO AGAIN!!!","2022-11-13T20:22:54Z","UC-l69It3hxAY3tkBH_utLNQ","Life Uncontained","22","22.17.11","shipping container home|shipping container house|shipping container|off grid|living off grid|diy|container home|tiny home|tiny house|vlog|self reliance|container delivery|landscaping|farm|shipping container build","439251","0","0","2741","https://i.ytimg.com/vi/FUIz7FPBgC8/default.jpg","False","True","WANT TO HELP SUPPORT OUR CHANNEL?https://www.patreon.com/lifeuncontainedCheck out our t-shirt shop!https://shop.spreadshirt.com/lifeuncontainedInstagram:https://www.instagram.com/lifeuncontainedFacebook:https://www.facebook.com/Life-Uncontained-100756834901218LIFE UNCONTAINED is a registered trademark. All rights reserved.MB01QHCPB8E2ZH1  MB01BFOFG1OR0K0MB01ALE70AUPMVPMB0191QTQMDBNKIMB01F8W6XXFVJGF  MB01PKFHNK8FQ71MB019ZEIAPE9V5L"
"xkvlhwqNPNY","GARNACHO STOPPAGE-TIME WINNER! 😮‍💨 | Fulham 1-2 Man Utd | Highlights","2022-11-13T22:00:07Z","UC6yW44UGJJBvYTlfC7CRg2Q","Manchester United","17","22.17.11","manchester united|mufc|man utd|manutd|mu|ggmu|old trafford|goals|highlights|raphael varane|jadon sancho|cristiano ronaldo|ronaldo|ronaldo goals|david de gea|de gea|maguire|shaw|fred|mctominay|man utd goals|Elanga|Rashford|Marcus Rashford|Bruno|Bruno Fernandes|Lindelof|Erik ten Hag|Ten Hag|Martinez|Malacia|Eriksen|Casemiro|Antony|MU Highlights|Garnacho|Garnacho Goal|Fulham v Man Utd|Man Utd highlights|MU v|Man Utd v|Eriksen goal|PL Highlights","4587509","0","0","2534","https://i.ytimg.com/vi/xkvlhwqNPNY/default.jpg","False","True","Watch highlights of Christian Eriksen's first goal for United and relive the scenes after Alejandro Garnacho's late winner at Craven Cottage against Fulham in the Premier League 👊▶️ Subscribe to Manchester United on YouTube at http://bit.ly/ManU_YT📲 Download the Man Utd app: http://manutd.co/F4c💻 Visit Manchester United: http://www.manutd.com🛒 Shop your favourite United attire: https://bit.ly/3s9uTW7#MUFC"
"Z88ml-kq8Iw","God of War Ragnarok - Kratos Crying as He Becomes The God of Peace, The All Father","2022-11-13T22:05:08Z","UCEvNGwLX3AKUAZRwTqrhhSQ","VGS - Video Game Sophistry","20","22.17.11","God of War Ragnarok|God of War Ragnarok - Kratos Crying|god of war ragnarok god of peace|god of war ragnarok kratos the god of peace|god of war ragnarok kratos becomes the all father|god of war ragnarok kratos crying as he becomes|kratos becomes the god of peace|kratos becomes the all father","291864","0","0","795","https://i.ytimg.com/vi/Z88ml-kq8Iw/default.jpg","False","True","God of War Ragnarok - Kratos Crying as He Becomes The God of Peace, The All Father https://youtu.be/Z88ml-kq8IwGod of War Ragnarok - All Character Scenes, Endings + Lore Guideshttps://www.youtube.com/playlist?list=PL__d-O-iz-xD9ENwTHiogXebg9HXm_KASSubscribe Here! http://bit.ly/VideoGameSophistrySubFor Video Game Sophistry-Twitter: https://twitter.com/VGSophistryFacebook: https://www.facebook.com/videogamesophistry/#VGS #GodofWar #GodofWarRagnarokAll content is recorded and user created, with either commentary or editing curation Intro Music Copyright Free Jazz Instrumental - On The Cool Side - Kevin MacLeodAbout Video Game Sophistry:Video Game Sophistry is an opportunity to celebrate the creators and the artistry found in Video Games. I believe that Games are the most effective medium from experiencing another world, and another way to live. Expect to see a series of videos showcasing the narratives hidden in every game, interviews with game developers, along with our bench mark weekly podcast, Dialogue Wheel. VGS - Video Game Sophistryhttps://www.youtube.com/user/VideoGameSophistry"
"IE1D9BEnYGM","Ronaldo's Interview with Piers Morgan! | McKola Reacts","2022-11-13T22:46:31Z","UCNztAy7T_eD6_TjikgZYZwQ","Adam McKola","17","22.17.11","Adam McKola|Full Time DEVILS|Manchester United|Man United|Man Utd|Manchester Utd|Fan TV|Fan Channel|stretford paddock|ronaldo piers morgan|ronaldo piers interview|ronaldo piers morgan interview|ronaldo interview|ronaldo mckola reacts|ronaldo mckola|mckola reacts|mckola reaction|reaction to ronaldo|man utd latest news|ronaldo ten hag|ronaldo rangnick|ronaldo respect|ronaldo exclusive|cristiano ronaldo interview|mckola cristiano ronaldo|reaction","160040","0","0","1713","https://i.ytimg.com/vi/IE1D9BEnYGM/default.jpg","False","True","Cristiano Ronaldo has said he has no respect for Ten Hag and that Manchester United have betrayed him in an interview with Piers Morgan - McKola reacts!Links to all socials here: https://linktr.ee/adammckolaSubscribe to my channel here: http://bit.ly/AdamMcKolaTVSubscribe to my Twitch here: https://twitch.tv/adammckolaSupport AMTV here and get bonus content & features: https://bit.ly/JoinAMTVLinks to McKola & Rory Podcast: https://linktr.ee/McKolaNRorySubscribe to Straight Up: http://bit.ly/StraightUpYTSubscribe to Stretford Paddock: https://bit.ly/DEVILSsub Like. Comment. Share. Make sure you hit that subscribe button for DAILY content!!JOIN FOR MORE FROM AMTV: https://bit.ly/JoinAMTVAdam McKolaYou can also find me on...Twitter: @AdamMcKolaSnapchat: AdamMcKolaInstagram: AdamMcKolaFacebook.com/AdamMcKolaTwitch: AdamMcKolaTikTok: adammckola_"
"YP157m-kWGw","Can we SURVIVE THE WINTER in this bus? (we’re worried)","2022-11-13T20:29:45Z","UCEJM4kRM01cY-2NeJ4-3nbw","Kinging- It","19","22.17.11","Van life|kinging-it|#vanlife|van conversion|van life vlog|van life couple|Van life build series|eamon and bec|full time van life|travel couple|winter van life|travel vlog|van life build|van winterising|Van life vlog winter|van build|winter vanlife|off the grid|vanlife uk|living in a van|Vanlife","155026","0","0","1182","https://i.ytimg.com/vi/YP157m-kWGw/default.jpg","False","True","Winter #vanlife is about to commence... before that, go get heathy, head over to http://athleticgreens.com/kingingit and get a 1 year supply of Vitamin D + 5 individual travel packs FREE with your first purchase! Our van build renovations are still undergo this week as we prepare for vanlife in Norway! Our big man list is 99% finished, the batteries are sorted for living off grid, the heaters have been installed, our grey waste is flowing nicely (lol) and the inside has had a glow up! We will be back in a few weeks as we're taking some time off due to mental health reasons ❤️See you soon! A&C 🚍 Our bus stats:2001 Mercedes Vario 8144.2 Litre turbo Diesel Was 24 seats (now 2) Air Suspension🚗 Top 10 videos to watch on Kinging-it’s channel:WATCH HERE! - http://bit.ly/3uHC5sy➡️👫 A bit about US- We are Craig and Aimee, from South Wales, UK. After Aimee was diagnosed with Cancer at 18 and Craig broke his neck shortly after by a freak accident, we decided life really is too short. Watch our story here -  https://bit.ly/3kuiZBA 🎼 MUSIC +! STOCK FOOTAGEThe music in this video is all copyright free and from Artlist -Sign up here for 2 months FREE: https://bit.ly/3yLpN3r-Stock Footage - https://artgrid.io/Social Media -🟦 Facebook - https://www.facebook/com/kingingit🟥 Instagram - https://www.instagram.com/wearekingingit🟨 Website - http://www.kinging-it.com🟪 Twitter - https://twitter.com/kingingit100🌼SHOP  Get your Kinging-it clothing here -  http://www.kinging-it.com/shop🌸PODCAST Kinging it PODCAST - https://www.kinging-it.com/the-podcast#Vanlife"
"k44QFOrNODU","La plus grande bataille de peinture de France ! (Ft. Billy, Lebouseuh, Amine, Domingo, Doigby, Xari)","2022-11-12T13:30:14Z","UCL9aTJb0ur4sovxcppAopEw","Inoxtag","24","22.17.11","INOXTAG|INOX|CROUTON|inox amine|inox bouzi|billy amine|xari pa|pa|domingo|bouzi|lebouseuh|bataille de peinture|splatoon inox|splatoon nintendo|nintendo","3070355","0","0","3138","https://i.ytimg.com/vi/k44QFOrNODU/default.jpg","False","True","Yo la team !On a fait la plus grande bataille de peinture de France en 3 contre 3 avec Amine,Billy,PA,Xari et Lebouseuh. J’espère que vous allez kiffer la vidéo ! Comme toujours hésitez pas à vous abonner à et à liker la vidéo Le lien pour acheter le jeu Splatoon 3 : https://www.nintendo.fr/Jeux/Jeux-Nintendo-Switch/Splatoon-3-1924751.htmlAmine : https://www.youtube.com/c/Aminematue/aboutBilly : https://www.youtube.com/c/RebeuDeterPA : https://www.youtube.com/user/ElDom1nG0Xari : https://www.twitch.tv/xariLebouseuh : https://www.youtube.com/c/LeBouseuhGamingMerci à la prod, aux équipes techniques ainsi que Nintendo.Chef Monteur : Hakki Sen - Aeron Mixeur son : Timothée Le HecMotion Design : Késiah Cécé - CCKesiahDesign : Arthur Roger - DigitalaptypMiniature : AziatackDécoration : Yves Hocquet et toute son équipeChef Peinture : Larim1983 & Comer OBKRéalisation : Filip Trad / Max Dmitrievski Directeur technique : Wandrille Robert Adjoint technique : Jonathan Faro Techniciens Vidéo : Romain Tissier & Elie YoussefChefs OPV : Gérald Breistroff, Brice Paradie & Adrien Bouchet Chef OPS : Jean-Christophe  LionOpérateur son : Killian FanjetArena Stade couvert de Liévin : Jean Marie Petitpre, Roger Gawlowski & Déborah Ducq🎥 Chaîne secondaire : https://inoxtag.tv/inoxtag2.0💙 T'abonner : https://inoxtag.tv/subscribe🔔✅ Activez la cloche de notification, afin d'être au courant de mes prochains lives ou vidéos !💜 Twitch: https://inoxtag.tv/twitch🐤 Twitter: @Inoxtag / https://inoxtag.tv/twitter🚀 Actualités: @InoxtagTV_ / https://inoxtag.tv/news📸 Instagram: @Inoxtag / https://inoxtag.tv/instagram📞 Discord: https://inoxtag.tv/discord📡 Reddit: https://inoxtag.tv/reddit💎 Deviens Sponsor: https://inoxtag.tv/sponsor💌 SponsorShip : inoxtag@talentweb.fr"
"EQP-lfVRgX8","I Tried Secret Service Academy","2022-11-12T14:19:23Z","UCGGZ_POGmIWG1pQXTDzQv-g","Michelle Khare","24","22.17.11","secret service|united states|michelle khare|challenge accepted|business insider|news|election|party|president|usss|trump|biden|politics|government|how to|how to get a job|fbi|police|firefighter|army|military|marines|bodyguard|uniformed division|agent|special agent|cia|spy|secret|nsa|cnn|fox news|motorcade|presidential motorcade|pence|kamala harris|boot camp|academy|bootcamp","2111273","0","0","7733","https://i.ytimg.com/vi/EQP-lfVRgX8/default.jpg","False","True","💪🏽 Download my workout app ► https://MKfit.coINSTAGRAM ► https://www.instagram.com/michellekhareTWITTER ► https://twitter.com/MichelleKhareDISCORD ► https://discord.gg/FCMYanYAvjThank you so much to the United States Secret Service for making this project possible! Learn more about USSS here: http://www.secretservice.gov/careers TEAM MK:Directed by Garrett Kennell ► http://www.instagram.com/garrettkennell​Edited by Silas Orteza ► http://www.silasorteza.com/​Assistant Producer - Carissa S.Director of Photography - Kevin Stiller ► https://www.kevinstiller.comMotion Graphics Artist - KJ - https://vimeo.com/rvltnsgThumbnail designed by @venturepsdProduction and Post Production Audio Services Provided by Paper Mountain Post LLC - https://www.papermountainpost.co/Production Sound Mixer - Christina GonzalezSupervising Sound Editor | Sound Designer - Domenic Orsi MPSESupervising Sound Editor | Re-recording Mixer - Christina Gonzalez"
"SUr4_132KAc","🇸🇦 Saudi Arabia vs 🇵🇭 Philippines | Basketball Highlights - #FIBAWC 2023 Qualifiers","2022-11-13T18:50:09Z","UCtInrnU3QbWqFGsdKT1GZtg","FIBA - The Basketball Channel","17","22.17.11","Highlights|Basketball|Basketball Highlights|FIBA|Full Highlights|FIBA Basketball World Cup 2023 Qualifiers|FIBA World Cup Qualifiers|13.11.2022|KSA v PHI 13.11.2022|Saudi Arabia|Saudi Arabia (KSA)|Philippines|Philippines (PHI)|Asian Qualifiers|FIBA Basketball World Cup 2023 - Asian Qualifiers","309036","0","0","356","https://i.ytimg.com/vi/SUr4_132KAc/default.jpg","False","True","The Philippines completed a perfect window on the road as they completed a strong win over Saudi Arabia in Jeddah.#FIBAWC Qualifiers #WinForAll #Basketball💥 Love to watch basketball? We show dozens of free live games per week! Subscribe and hit the bell! http://fiba.com/subYT📺 Watch live games and extended highlights on Courtside1891:Game highlights https://bit.ly/W5-WATCH1​Click here for more: https://www.fiba.basketball/es/basketballworldcup/2023/asia-qualifiersFacebook: http://facebook.com/FIBAWCTwitter: http://twitter.com/FIBAWCInstagram: http://instagr.am/fibawcTikTok: https://www.tiktok.com/@fibaSina Weibo: http://weibo.com/FIBAofficial#basketball | baloncesto | basquete | basquetebol | 농구 | basket | バスケットボール | バスケ | pallacanestro | bola basket | 篮球 | баскетбол | basketbol | basketbolda | baskette |  كرة السلة | Баскетбол"
"jQx4n0IgNX0","Playing Every GTA Without Breaking Any Laws!","2022-11-13T16:00:32Z","UC1n_yB_W-FZCbwajZPcs8Jw","UnspeakablePlays","20","22.17.11","minecraft|unspeakable|unspeakableplays|mini game|game|custom|crazy|challenge|modded|games|maps|secret|redstone|funny moments|mcpe|minecraft pe|pocket edition|unspeakablegaming|trolling|gameplay|playthrough|traps|glitch|funny|craziest|prank|pranks|no cursing|no swearing|creations|facts|how to|parody|adventure|comedy|video|Grand theft auto V|Breaking laws GTA|Gta no stars|GTA V challenge|GTA V mod|GTA V RP|GTA V 5 stars|GTA V without breaking laws|GTA V custom","327304","0","0","413","https://i.ytimg.com/vi/jQx4n0IgNX0/default.jpg","False","True","NEW MERCH! - https://www.unspeakable.com/PLAY NEW GAMES! - https://www.unspeakable.com/pages/play-gamesFOLLOW ME! - https://www.unspeakable.com/pages/linksPLEASE leave a like & subscribe this video was expensive!! THANK YOU! I love tacos"
"O5myIiXLqug","Pokemon Battle Royale: ULTRA BEASTS! Collab w/ @Lockstin & Gnoggin (Loud Sound/Flashing Lights) 👽","2022-11-12T16:00:12Z","UCLFXk9J3O-hhOk0msOjKYdQ","TerminalMontage","20","22.17.11","terminalmontage|terminal|montage|jeremey|jer|chinshue|nintendo|animation|cartoon|animated|something|about|cartoon violence|fighting|action|meme|parody|comedy|funny|loud|screaming","2836918","0","0","7905","https://i.ytimg.com/vi/O5myIiXLqug/default.jpg","False","True","Alien Pokemon from another dimension? Which one is the strongest? This time we're putting every Ultra Beast on an island to see who will win in a battle royale! Make sure you check out Lockstin's Analysis Video here: https://youtu.be/CyQkW1oTlMcWatch the other Battle Royales here: https://www.youtube.com/playlist?list=PL_nUhPfMOdad6jsHc7Sl_mfCVJFJ7M5TCResearch and Writing by Lockstinhttps://www.youtube.com/user/Lockstin2https://www.gnoggin.net/Animatic, Animation, Additional Backgrounds, Coloring, Lineart, Sound Design, Special Effects by Jeremey Chinshuehttps://twitter.com/JeremeyChinshueBackgrounds, Background Animation, Coloring, Special Effects by Edgar Nielsenhttps://twitter.com/funymonyhttps://www.mediamuffin.com/Coloring, Additional Material by Lollergator________________http://www.TerminalMontage.comPatreon: https://www.patreon.com/terminalmontageTwitter: https://twitter.com/TerminalMontageFacebook: https://www.facebook.com/TerminalMontage/Instagram: https://www.instagram.com/jeremeyyyyyy/Merch: https://terminalmontagemerchportal.weebly.com/Clips Channel: https://www.youtube.com/TerminalMontageClips________________Music:Pokémon HeartGold & SoulSilver - Battle! Champion (SNES Remix) - By TheLegendOfRenegade II https://www.youtube.com/watch?v=iEAzjvjAdQUWhen Instincts Collide - Christian Andersen (EpidemicSound)Pokémon Sun/Moon - Trainer Battle Theme (8-bit Chiptune Remix) - By MyNewSoundtrack https://www.youtube.com/watch?v=bHz7P4uWDOMPokémon Diamond & Pearl - Battle! Team Galactic (CPS-2 Remix) - By TheLegendOfRenegade II https://www.youtube.com/watch?v=cFb83GKacuoPokémon ORAS - Team Aqua/Magma Grunt (Pkmn BW Remix) - By MyNewSoundtrack https://www.youtube.com/watch?v=N8zmTmaPXS0Pokemon RBY Trainer Defeated (Harvest Moon SNES Soundfont) - KHInsider.com https://www.khinsider.com/midi/gameboy/pokemon-red-blue-yellow-Pokémon Mystery Dungeon: Blue Rescue Team - Friend Area ~ Pond (Sega Genesis Remix) - By TheLegendOfRenegade II https://www.youtube.com/watch?v=WTDUr12DWoECredits theme; Garden Stage by Jattello https://youtu.be/WSDSCWLkaXE?t=2679For advertising email: Marketing@Frederator.comTERMINALMONTAGE® SOMETHING ABOUT® SOMETHING SERIES®Registered in the U.S. Patent and Trademark Office.© TERMINALMONTAGE LLC. All Rights Reserved. For additional legal information, please see: https://terminalmontageportal.weebly.com/legal-notices-and-disclaimers.htmlPokemon Sun and Moon gave us the ultra beasts:Nihilego, Buzzwole, Pheramosa, Stakataka, Guzzlord, Blacephalon, Kartana, Celesteela, Poipole, Naganadel, Xurkitree, and Miltank... well I guess Miltank is here too. But which ultra beast would win in a battle royale? https://youtu.be/CyQkW1oTlMc#SomethingSeries #Pokemon #battleroyale #animation #cartoon #nintendo #gaming #gamingvideos"
"ZzmiR6n4sxk","Melhores Momentos | UFC 281: Adesanya x Poatan","2022-11-13T13:08:25Z","UCk8XGxi7fsTqQQRVq9LSraw","UFC Brasil","17","22.17.11","UFC|UFC Brasil|UFC Lutas|UFC Nocautes|UFC Ao Vivo|UFC Fight|Assistir UFC|UFC Videos|Alex Poatan|Israel Adesanya|UFC 281|Nocaute|Poatan|Zhang Weili|Dustin Poirier|Renato Moicano","2351633","0","0","2527","https://i.ytimg.com/vi/ZzmiR6n4sxk/default.jpg","False","True","As conquistas de cinturão de #AlexPoatan e #ZhangWeili, o duelo fenomenal entre Dustin Poirier e Michael Chandler, a finalização de Renato Moicano e muito mais: assista aos melhores momentos do histórico #UFC281!00:17 - Carlos Ulberg x Nicolae Negumereanu02:02 - Michael Trizano x Seung Woo Choi05:06 - Matt Frevola x Ottman Azaitar07:15 - Erin Blanchfield x Molly McCann09:50 - Dominick Reyes x Ryan Spann11:36 - Brad Riddell x Renato Moicano14:29 - Dan Hooker x Claudio Puelles16:56 - Frankie Edgar x Chris Gutierrez18:25 - Dustin Poirier x Michael Chandler22:23 - Carla Esparza x Zhang Weili24:51 - Israel Adesanya x Alex PoatanSe inscreva para ter todo o conteúdo mais recente do UFC Brasil: https://ufc.ac/3ofRm20Se inscreva para saber tudo sobre o lançamento do UFC FIGHT PASS® no Brasil: https://www.ufc.com.br/ufcfightpassAssine o Combate para assistir a todos os eventos do UFC: https://glo.bo/3dAWqXpConecte-se com o UFC em todas as plataformas:🔴 Website: http://www.ufc.com.br🔵 Twitter: https://twitter.com/UFCBrasil🔵 Facebook: https://www.facebook.com/UFCBrasil🔴 Instagram: https://www.instagram.com/ufc_brasil/⚫️ TikTok: https://www.tiktok.com/@ufcbrasil🟣 Twitch: https://www.twitch.tv/ufcCadastre-se para receber notícias e conteúdo exclusivo do UFC no seu email: https://www.ufc.com.br/newsletter"
"EPwugTRTscg","My Pregnant Golden Retriever Gives Birth to 12 PUPPIES! | Episode 7","2022-11-13T19:00:17Z","UCpjZg9xEZWdjeeQEeIAj-sA","Mister Preda","22","22.17.11","DANIEL PREDA|daniel|preda|daniel and joey|joey graceffa|joey|graceffa|puppies|12 puppies|golden retriever|golden retriever puppy|golden retriever puppies|golden|retriever|puppy|pup|newborn|newborn puppy|christmas|holidays|holiday|fall|winter|los angeles|new puppy|grwm|diy|home decor|meet my puppy","204319","0","0","824","https://i.ytimg.com/vi/EPwugTRTscg/default.jpg","False","True","TODAY IS THE DAY! 😀 @Joey Graceffa and I helped my girl Monty deliver twelve incredible angels 💜  This pregnancy was smooth sailing and she did SO well. I wanted to include a sad reality that happened, we lost one sweet angel. It absolutely tore me to shreds but I did my best, we did our best, although she was already gone and I wanted to be transparent with you all. I named her Snowball and she will always be a part of our little family. I hope you choose to show love and kindness here in the comments. We have some angels to take care of! See you Tuesday with a new video! xo Daniel Follow me on IG: https://bit.ly/3gSa4a4Follow me on TikTok: https://bit.ly/3NRm8u7Check out Joey: https://bit.ly/3A4bSJdMy Skincare Favs: https://bit.ly/misterpredaUNMESS Series: https://www.youtube.com/watch?v=HByTRhYj8Ks#goldenretriever #puppies #puppy"
"yHcCK2eO7OA","✅ or ❌ | Neville, Carragher, Redknapp & Carney pick their England XI's 👀","2022-11-13T20:08:49Z","UCZ7wY7MRDSygp63HIEfdQZA","Sky Sports Football","24","22.17.11","Sky Sports|Sky Sports Football|football|soccer|stream|livestream|World Cup|Qatar 2022|WC|England|Jamie Carragher|Carragher|Gary Neville|Neville|Jamie Redknapp|Karen Cairney|Redknapp|Neville Carragher|Marcus Rashford|Harry kane|mount|maddison|maguire|stones|saka|toney|wilson|southgate","820852","0","0","2767","https://i.ytimg.com/vi/yHcCK2eO7OA/default.jpg","False","True","SUBSCRIBE ► https://bit.ly/SubscribeSkyFootballGary Neville, Jamie Carragher, Jamie Redknapp and Karen Cairney pick their England XI's ahead of the World Cup in Qatar, do you agree with their decisions?►TWITTER: https://twitter.com/skysportsfootball►FACEBOOK: http://www.facebook.com/skysportsfootball►WEBSITE: http://www.skysports.com/footballMORE FROM SKY SPORTS ON YOUTUBE:►SKY SPORTS PREMIER LEAGUE: https://bit.ly/SubscribeSkySportsPL►SKY SPORTS FOOTBALL: https://bit.ly/SubscribeSkyFootball►SKY SPORTS BOXING: http://bit.ly/SSBoxingSub►SKY SPORTS CRICKET: http://bit.ly/SubscribeSkyCricket►SOCCER AM: http://bit.ly/SoccerAMSub►SKY SPORTS F1: http://bit.ly/SubscribeSkyF1►SKY SPORTS: http://bit.ly/SkySportsSub►SKY SPORTS GOLF: https://bit.ly/SubscribeSkySportsGolf"
"r6fO85gfSlE","DEJI REVEALS WHAT KSI TOLD HIM AFTER LOSS TO FLOYD MAYWEATHER, REACTS TO SIDEMEN EMBRACING HIM","2022-11-13T23:09:42Z","UCCh-tgR7B-1jXvMZOE7ebiQ","Pro Boxing Fans","17","22.17.11","Boxing|Boxeo|Boxing News|Boxing Latest|Boxing Updates|Deji|KSI|Sidemen|Floyd Mayweather","393419","0","0","618","https://i.ytimg.com/vi/r6fO85gfSlE/default.jpg","False","True","Deji reveals what KSI told him and talks having the Sidemen ringside after his exhibition with Floyd Mayweather. Check out the video! #Deji #KSI #Sidemen #FloydMayweather #Boxing #CombatSports 🥊 SUBSCRIBE TO OUR YOUTUBE CHANNEL: https://www.youtube.com/user/proboxingfans/🥊 FOLLOW US ON TWITTER: https://twitter.com/ProBoxingFans🥊 FOLLOW US ON INSTAGRAM: https://www.instagram.com/proboxingfans/🥊 LIKE OUR FACEBOOK PAGE: https://www.facebook.com/proboxingfans/🥊 CHECK OUT OUR WEBSITE: https://www.proboxing-fans.com/"
"AgIeM8NE1yE","The judges can't stop laughing at these FUNNY auditions | AGT 2022","2022-11-12T14:00:08Z","UCT2X19JJaJGUN7mrYuImANQ","America's Got Talent","24","22.17.11","Simon Cowell|America's Got Talent|AGT|AGT 2022|America's Got Talent 2022|Got Talent|AGT auditions 2022|Got Talent 2022|Mr. Pants|Lace Larrabee|Ben Lapidus|Parmesan Song|I always want more parmesan|funny auditions|got talent funny|funny agt|agt funny|funniest auditions|you laugh you lose|judges can't stop laughing|judges laugh","577156","0","0","130","https://i.ytimg.com/vi/AgIeM8NE1yE/default.jpg","False","True","Mr. Pants, Lace Larrabee, and Ben Lapidus made the judges howl with laughter when they auditioned for AGT! » Get The America's Got Talent App: http://bit.ly/AGTAppDownload» Subscribe for More: http://bit.ly/AGTSub» Watch on NBC & Peacock: https://pck.tv/3cCQGhHAMERICA'S GOT TALENT ON SOCIALLike AGT: https://www.facebook.com/agtFollow AGT: https://twitter.com/agtAGT Instagram: http://instagram.com/agtFind America's Got Talent trailers, full episode highlights, previews, promos, clips, and digital exclusives here.NBC ON SOCIAL:YouTube: http://www.youtube.com/nbcTwitter: http://Twitter.com/NBCFacebook: http://Facebook.com/NBCInstagram: http://instagram.com/nbcABOUT AMERICA'S GOT TALENTThe 17th season of America's Got Talent returns with a new set of aspiring performers looking to compete for the ultimate $1 million prize. Executive Producer Simon Cowell returns to the star-studded judging panel with global fashion icon Heidi Klum, fan-favorite comedian Howie Mandel and acclaimed actress and international superstar Sofia Vergara. The dynamic Terry Crews returns as host. This season promises to deliver some of the wildest acts to ever grace the AGT stage.America's Got Talent is available now on Peacock, the new streaming service from NBCUniversal. Watch thousands of hours of hit movies and shows, plus daily news, sports, and pop culture updates. Stream now on Peacock.The judges can't stop laughing at these FUNNY auditions | AGT 2022https://youtu.be/AgIeM8NE1yEAmerica's Got Talenthttp://www.youtube.com/user/americasgottalent#AGT #AmericasGotTalent #Auditions"
