video_id,title,publishedAt,channelId,channelTitle,categoryId,trending_date,tags,view_count,likes,dislikes,comment_count,thumbnail_link,comments_disabled,ratings_disabled,description
"mjPShYQMxS0","8LOOM ｢Melody｣ OFFICIAL MV [ENG/KOR/CHN SUB] 【TBS】","2022-11-09T08:00:09Z","UCxpIo6FFB7gMQz2Fy2X8XdQ","TBS公式 YouTuboo","24","22.15.11","TBS|ＴＢＳ|8LOOM|8ROOM|BLOOM|BROOM|高橋文也|ブルーム|きみはな|君花","1589948","0","0","1948","https://i.ytimg.com/vi/mjPShYQMxS0/default.jpg","False","True","毎週火曜よる10時放送中!!　本田 翼主演 TBS系火曜ドラマ『君の花になる』 挫折した元高校教師でひょんなことから７人組ボーイズグループ・8LOOM(ブルーム)の “寮母”になる主人公・あす花を演じる！それぞれ苦難を味わいながらも、諦めず、一緒に“トップアーティストになる夢”に向かっていく…！！そして、8LOOMは劇中だけでなく、期間限定のボーイズグループとして実際にデビュー！ドラマ楽曲の発表、物語と連動したライブ、イベントなど多岐にわたる活動を行っていく。★「君の花になる」楽曲配信リンク★https://8loom.lnk.to/kimihanaApple Music、Spotify、LINE MUSIC、AWA、iTunes、mora、レコチョクをはじめ、各サブスクリプション、ダウンロードサービスにて配信中。★3rdシングル「Melody」LINE MUSIC再生キャンペーン★8LOOMツアーご招待チケットやメンバー役名サイン入りグッズが当たるスペシャルキャンペーン開催中！https://questant.jp/q/8LOOM_Melody 再生対象期間：11月9日(水)午前0時〜11月15日(火)午後11時59分応募期間　　：11月9日(水)午前0時～11月17日(木)午後11時59分https://www.tbs.co.jp/kiminohananinaru_tbs/https://twitter.com/kimihana_tbshttps://www.instagram.com/kimihana_tbs/https://www.tiktok.com/@kimihana_tbs/★3rdシングル｢Melody｣OFFICIAL MV★https://youtu.be/mjPShYQMxS0★2ndシングル｢君の花になる｣OFFICIAL MV★https://youtu.be/qg-T-hXQuxs★1stシングル ｢Come Again｣OFFICIAL MV★https://youtu.be/aj8vGYBUugA★8LOOM (火曜ドラマ『君の花になる』) 再生リスト★https://youtube.com/playlist?list=PLCUNF--_h4OwW2enAJtxoKNbdO_EKRSMq★【8LOOM ROOM～君花アフターパーティー!】撮影ウラ話&未公開映像もお届け!★https://www.paravi.jp/title/102342?utm_source=youtube_tbs&utm_medium=groupsite&utm_campaign=banner&utm_content=kiminohana_tbs★【君の花になるまでの３６５日】再生リスト★https://youtube.com/playlist?list=PLCUNF--_h4OyyVIxv-ax-H69N4neJagne★未公開映像を含む完全版をParaviで独占配信中★https://bit.ly/3M1oW64■番組概要本作は、ある出来事により挫折した元高校教師の主人公・仲町あす花（なかまち・あすか）が、崖っぷちの７人組ボーイズグループ“8LOOM（ブルーム）”の寮母となり、一緒に“トップアーティストになる”という夢に向かっていく物語だ。あす花は突如、ボーイズグループが共同生活する寮の“寮母”になったことをきっかけに、高橋文哉演じる、かつての教え子・佐神弾（さがみ・だん）と再会する。弾がグループのリーダーとして夢に向かってまっすぐ挑戦する姿に心を打たれ、気づけば教師だった頃の情熱を取り戻し、自身の挫折とも向き合うようになっていく。３０歳の節目に、恋も仕事も友情も新たなステージへ進む女性の成長と胸キュンを描いたオリジナルストーリーである。■出演者仲町あす花 … 本田翼佐神弾 … 高橋文哉成瀬大二郎 … 宮世琉弥古町有起哉 … 綱啓永一之瀬栄治 … 八村倫太郎桧山竜星 … 森愁斗久留島巧 … NOA小野寺宝 … 山下幸輝池岡奈緒 … 志田彩良三ツ谷満男 … 菊田竜大 (ハナコ)リリカ … 川津明日香ミナト … 木村柾哉ユズ … 髙塚大夢イブキ … 田島将吾シュウヘイ … 藤牧京介ナユタ … 松田　迅　　　　（INI）仲町優里 … 木南晴夏添木ケンジ … 宮野真守香坂すみれ … 内田有紀トリニティ春日 … 竹中直人花巻由紀 … 夏木マリ#8LOOM #君の花になる #本田翼#高橋文哉#宮世琉弥#綱啓永#八村倫太郎#森愁斗#NOA#山下幸輝#tbs"
"Kn5iNcxdxpo","EFL Cup Highlights: Arsenal 1 Albion 3","2022-11-10T01:00:07Z","UCf-cpC9WAdOsas19JHipukA","Official Brighton & Hove Albion FC","17","22.15.11","Brighton|Hove|Albion|Premier league|Seagulls|amex stadium|Brighton Hove Albion|epl|kaoru mitoma|goal|1-3|arteta|knocked out|Tariq lamptey|Danny welbeck|Jason steele|penalty|elf cup|highlights|league cup","2792529","0","0","1402","https://i.ytimg.com/vi/Kn5iNcxdxpo/default.jpg","False","True","Albion dump Arsenal out of the EFL Cup as Danny Welbeck, Kaoru Mitoma and Tariq Lamptey fire the Seagulls into the last 16."
"TxwIpjjankI","[단독샷캠4K] 르세라핌 'ANTIFRAGILE' 단독샷 별도녹화│LE SSERAFIM ONE TAKE STAGE @SBS Inkigayo 221106","2022-11-10T09:00:16Z","UCS_hnpJLQTvBkqALgapi_4g","스브스케이팝 X INKIGAYO","24","22.15.11","Inkigayo|인기가요직캠|안방1열직캠|스브스케이팝|스브스 직캠|인기가요|인가|음방|음악방송|르세라핌|LE SSERAFIM|ANTIFRAGILE|르세라핌 컴백|르세라핌 인가|르세라핌 인기가요|르세라핌 직캠|르세라핌 페이스캠|르세라핌 무대|르세라핌 안무|르세라핌 신곡|쏘스뮤직|사쿠라|김채원|허윤진|카즈하|홍은채|SAKURA|KIM CHAEWON|HUH YUNJIN|KAZUHA|HONG EUNCHAE","1764432","0","0","903","https://i.ytimg.com/vi/TxwIpjjankI/default.jpg","False","True","[단독샷캠4K] 르세라핌 'ANTIFRAGILE' 단독샷 별도녹화│LE SSERAFIM ONE TAKE STAGE @SBS Inkigayo 221106(Ft. 스탠다드 별도녹화)#인기가요 #르세라핌 #ANTIFRAGILE---------------------------------------------------------------------------------------☞ MORE ＂SBS KPOP＂Twitter : https://twitter.com/kpop_sbsFacebook : https://www.facebook.com/sbskpopInstagram : https://instagram.com/sbskpop_official"
"66UWdooHDqw","関ジャニ∞ - がむしゃら行進曲 (from KANJANI∞ STADIUM LIVE　１８祭)","2022-11-10T02:00:02Z","UCruUAAgi8FPOEhV_6nxD0ew","J Storm Official","10","22.15.11","関ジャニ∞|関ジャニ|かんじゃに|横山裕|村上信五|大倉忠義|安田章大|丸山隆平|ジャニーズ|SnowMan|SixTONES|johnnys|johnny's|ジャニーズ Jr|johnny's jr|嵐|ARASHI|ジャニーズWEST|なにわ男子|Aぇ! Group|がむしゃら行進曲|喝采|18 祭|ドーム|J Storm|ジェイストーム","569259","0","0","870","https://i.ytimg.com/vi/66UWdooHDqw/default.jpg","False","True","11.30 Release『KANJANI∞ STADIUM LIVE　１８祭』より、「がむしゃら行進曲」詳細・ご購入はこちら ＞ https://kanjani8.lnk.to/STADIUM_LIVE_18FesYT冬のドーム１８祭リハーサルが見学できるスペシャル企画はこちら ＞ https://www.infinity-r.jp/news/52192022年夏、関ジャニ∞が日産スタジアムとヤンマースタジアム長居にて開催した特大青春夏祭り「１８祭」！人気のダンス&バンドナンバー、関ジャニ∞のお祭り定番「ジャニーズメドレー」、そして「エイトレンジャー」やCMで話題になった「キャンジャニ∞」、更には総重量50t、地上20mを超える高さのウォータースプラッシュや800発の花火など、野外LIVEならではのド派手な演出が目白押し！関ジャニ∞流エンタテインメントを余すところなくお届け！冬のドーム１８祭詳細はこちら ＞ https://eighteen-fes2022.com/▼関ジャニ∞ 最新の動画はコチラ▼https://www.youtube.com/playlist?list=PL8rMMPgC2SWVVJNbuzO5o_D0G1o4CCTIP▼関ジャニ∞「KANJANI∞ STADIUM LIVE　１８祭」関連動画▼https://youtube.com/playlist?list=PL8rMMPgC2SWWwnYZFB4mN-dMbUSEQvnCJ#関ジャニ #関ジャニ１８祭"
"QvnZHVtBczI","#178【またこの3人w】ジャニーズをへんな角度で探ってみた日","2022-11-09T09:32:03Z","UC2alHD2WkakOiTxCxF-uMAg","ジャにのちゃんねる","24","22.15.11","[none]","2097313","0","0","3937","https://i.ytimg.com/vi/QvnZHVtBczI/default.jpg","False","True","皆様、こんばんは♪ジャにのちゃんねるです!!!!今週も後、半分頑張っていきましょう🕺山田のドラマがおもろくなって来た模様。。作品の事もあり、またこの3人ですが、楽しんで頂けたらと思っちょります🙇‍♂️昨日はラーゲリでケンティーとも会いました🙆‍♂️あ、卍に写真送らなきゃ！忘れてた👺という事で、今日の動画もお楽しみ下さい♪#ジャにの #メンカラ #ジャニーズメンカラの歴史"
"DTi4vbuEF14","【ポケモン剣盾】ぽよぽよ神ぺこぺこ神【ゆっくり実況】","2022-11-10T11:30:06Z","UCymUFlFt2gKlaCu0RRVYhDA","エルトライト","20","22.15.11","ポケモン|剣盾|ゆっくり|エルトライト|実況|マリルリ|ランクルス|ジャラランガ|とも湯|モルペコ|パンプジン|ダイオウドウ","209180","0","0","398","https://i.ytimg.com/vi/DTi4vbuEF14/default.jpg","False","True","色んなポケモン使えるとやっぱ楽しい～次回、剣盾最終回！とも湯さん視点→https://youtu.be/0sFKuGwqs3wチャンネル登録されると喜びます～■Twitter : @elepokemon※この動画は東方Projectをもとにした二次創作です。使用したポケモン恥ポヨポヨ→https://arandorosu.hatenablog.com/entry/2020/10/01/112616モルペコ：陽気ASパンプジン性格：おだやか努力値：H244-B116-D148ダイオウドウ性格：勇敢努力値：H12-A252-B116-D124【前回の動画】https://www.youtube.com/watch?v=nz7wh7Twntw【ポケモン剣盾再生リスト】https://www.youtube.com/watch?v=-rdqAlYylLQ&list=PLfDoPNXa-g8【ポケモンBDSP再生リスト】https://www.youtube.com/playlist?list=PLfDoPNXa-g8TA-3j8Xh0CPtPbDi-rY7o_【ポケモンUSUM再生リスト】https://www.youtube.com/watch?v=e17BkcCtfF8&list=PLfDoPNXa-g8Snlk6aBHu1PC21vuhpPEM8#ポケモン剣盾#ゆっくり実況#エルトライト使用素材：OtoLogic、music is VFR"
"eW620xcBnVE","【syudou】インザバックルーム","2022-11-09T11:00:08Z","UCraC7460yGQF4GDmSjCecpQ","syudou","10","22.15.11","syudou|シュドウ|手動|しゅどう|チェンソーマン|デンジ|ポチタ|パワー|マキマ|TVアニメ|インザバックルーム","1480765","0","0","1597","https://i.ytimg.com/vi/eW620xcBnVE/default.jpg","False","True","TVアニメ『チェンソーマン』第5話エンディング・テーマ配信：https://syudou.lnk.to/In_the_Back_Roomsyudouです。辿り着いた曲です。作詞・作曲・歌/syudou(https://twitter.com/tikandame)動画/ヤスタツ(https://twitter.com/yasutatsu_)Guitar/Kuboty(https://twitter.com/kuboty666)Bass/長島涼平(https://twitter.com/ryoheeey)カラオケ/歌詞：https://piapro.jp/syudou【TVアニメ「チェンソーマン」】https://chainsawman.dog/2022年10月11日(火)24:00より テレビ東京他にて放送開始2022年10月11日(火)25:00よりPrime Videoにて最速配信2022年10月12日(水)25:00より各プラットフォームにて見逃し配信漫画第二部「少年ジャンプ＋」にて連載中！----------------syudou Live 2023「我武者羅」日時：2023年4月8日(土) 開場16:00/開演18:00会場：幕張メッセイベントホールチケット料金：全席指定 6,600円 (税込) 特典付syudou公式アプリ「syudou商店」プレミアム会員先行受付：11月9日（水）20:00〜11月20日（日）23:59までhttps://youtu.be/5gaXZnoYWCE----------------「インザバックルーム」ちょっと待ってやっぱよくないって明日も続く地獄だね 出口が無い　　　　　　一切見つからないんだけどアナタなんか知ってる？思えば出会いは単純だったキツめの酒を喰らった様に頭がぐらぐらぐらした そして目が合った　　　一瞬の新興と引き換えに　　　　　　　一生と心臓を渡すのさ　　　　　　　　永遠続く不安と悪夢目覚めた時には毒虫になっていたジャンクで汚れたこの声でうるせぇ外野を黙らせるアンタがとやかく言わずともこちら側が殴り込んでやる邪悪な輩と蔑んだ　　　　　　　　　奴らの思考の外に出る愛だかなんだか知らねぇが望み通り深く堕ちてやるんだ辿り着いたぜアンタの背だけを追ってこの呪縛と束縛逃れてやるから　　　　　知ったこっちゃないって言われる様な価値も意味も無いプライドの理由は何一体気づいていない様で実は全部知ってる求愛だ崇拝だふざけんな　　　　無い方が楽勝に生きれるさ　　　　　　　　　　散々流してきた涙救いもせずただ音楽は鳴っていただけどさっさと切るべきプライドを一つも捨てずに成し遂げる愛した苦汁と辛酸だ　一粒も残さず飲んでやる一種の若気の至りだと舐めてた奴らに恥かかすこっちは生まれたその日から　言葉と刃なら研いである思えば出会いは単純だった恥に恥を塗る生涯だったそれでも俺は一つ勝ち取った眠れぬ夜や消えぬ後悔が何度も何度も何度も何度も何度もあったがここで歌っているジャンクで汚れたこの声でうるせぇ外野を黙らせるアンタがとやかく言わずともこちら側が殴り込んでやる邪悪な輩と蔑んだ　　　　　　　　　奴らの思考の外に出る愛だかなんだか知らねぇが望み通り深く堕ちてやるんだ辿り着いたぜアンタの背だけを追ってこの呪縛と束縛逃れてやるから　　ちょっと待ってやっぱまたループlike the backroom 憧れに出口は無い実際まだ出れないんだけどアナタなんか知ってる？______________________________________________________________「アンチテーゼ貴様 -改-」https://youtu.be/LTN_JyHq8Pchttps://syudou.lnk.to/Antithese_Kisama_kai______________________________________________________________Twitter：https://twitter.com/tikandameInstagram：https://www.instagram.com/syudou279/TikTok：https://www.tiktok.com/@syudouHP：https://www.syudou.comアプリ：https://syudou.com/app/______________________________________________________________#チェンソーマン#インザバックルーム#syudou"
"xwcwgeYs6n8","今後の活動についてお話しします","2022-11-10T10:34:16Z","UC0elp2101KAxbaAMzInGerA","きりたんぽ","24","22.15.11","きりたんぽ|きりたん","680108","0","0","2362","https://i.ytimg.com/vi/xwcwgeYs6n8/default.jpg","False","True","🍥🍥🍥🍥🍥🍥🍥🍥🍥🍥🍥🍥 お仕事依頼はこちらから☺️↓【kiritanposhigoto@gmail.com】(きりたんぽ本人が見るものではありません)※こちらのアドレスはお仕事専用で会社直通になります【きりたんぽの日常】https://www.youtube.com/channel/UCi-VeNo-6P6CKZtlIwbv3pQ【ツイッター】https://twitter.com/kiritampopopo【インスタグラム】https://www.instagram.com/kiritampopopo/【TikTok】ID：kiritampoきりたんぽファースト写真集｢ぽ｣電子書籍もでましたので合わせて是非チェックしてみてください✨🍥写真集｢ぽ｣🍥https://store.kadokawa.co.jp/shop/g/g321801000475/🍥電子書籍🍥https://bit.ly/2TvtLfp↓ファンレターはこちら↓〒107-6228東京都港区赤坂9-7-1 ミッドタウン・タワー 28階UUUM株式会社　きりたんぽ宛==================================[使った音楽]BGMerhttps://bgmer.net/フリー音楽素材/魔王魂https://maoudamashii.jokersounds.com/フリーBGM・音楽素材MusMus http://musmus.main.jp/DOVA-SYNDROMEhttps://dova-s.jp/しゃろう様https://www.youtube.com/channel/UCfjca6Z_wpyinTqHdIYJ49Q# # # # #"
"0TgEgMg9WTY","三代目 J SOUL BROTHERS LIVE STREAMING ~ JSB IS BACK ~","2022-11-10T10:48:03Z","UCobdZ56XzPzD7sAb9BrpHEg","三代目 J SOUL BROTHERS from EXILE TRIBE","10","22.15.11","[none]","263047","0","0","119","https://i.ytimg.com/vi/0TgEgMg9WTY/default.jpg","False","True","#三代目JSOULBROTHERS------------OFFICIAL SNS-WEBSITEhttps://jsoulb.jp/Twitterhttps://twitter.com/jsb3_officialInstagramhttp://instagram.com/jsb3_7officialTikTokhttps://vt.tiktok.com/ZSeWgRM2G/DL & STREAMhttps://jsb.lnk.to/music"
"k8XErwm2l0s","守田英正×レオザ対談後編-W杯での戦い方と急遽始まった個人分析-","2022-11-10T09:00:10Z","UCmsfo6_GmedEhParaNa3r9A","Leo the football TV","17","22.15.11","W杯|ワールドカップ|ラジオ|ナポリ|ライプツィヒ|トッテナム|サッカー|ニュース|スーパー|プレイ|ゴール|ウイイレ|PES|FIFA|ハイライト|テクニック|スキル|監督|れおざ|ふっとぼーる|レオザ|ヨーロッパ|トーク|分析|コラム|foot|ball|soccer|CL|ブンデス|プレミア|リーガ|セリエA|日本|代表|Leo|the|戦術|チャンピオンズ|リーグ|マドリー|レアル|バルセロナ|バイエルン|リバプール|PSG|マンチェスター|アーセナル|Talk|移籍|youtuber|ユーロ|イケメン|アトレティコ|ジャパン|JAPAN|ブログ|レポ|レポート|ユベントス|チェルシー|ミラン|森保|久保|久保建英|がっつり|解説|何が凄い？|特徴|長所|短所|プレースタイル","167797","0","0","512","https://i.ytimg.com/vi/k8XErwm2l0s/default.jpg","False","True","守田選手の著作「ずる賢さ」という技術　日本人に足りないメンタリティ (幻冬舎単行本)のお求めはこちらから👉https://amzn.asia/d/aiRtQP4前編👉https://youtu.be/NWPRXzYu-3MLeo the football が監督を務め東京都リーグに参戦しているクラブ “F.C.ŠVABO(シュワーボ)”への入団希望はこちらから体験入団受け付けていますので下のリンクからお申し込み是非っ👇https://www.fcsvabo.com/joinsvabo一般公開のYouTubeで話せない話をする生配信や過去の全授業(“Weekly 蹴球学”やサッカー界の著名人を講師に招いた特別授業)のアーカイブが見られるオンラインサロン『Leo the football 学園』の詳細・お申し込みはこちらから👇https://www.fcsvabo.com/メールでのお問い合わせ・お申し込みはleo.the.gakuen@gmail.com まで📧またF.C.シュワーボへのスポンサードを御検討頂ける方はこちらのページから👇小額からの募金も出来る仕組みになりましたhttps://www.fcsvabo.com/%E3%82%B9%E3%83%9D%E3%83%B3%E3%82%B5%E3%83%BC%E5%8B%9F%E9%9B%86日本サッカーを情熱と合理性で進化させるために作ったチームですので力を貸して頂ければ幸いです🙇‍♂️メールでのお問い合わせ・お申し込みはleo.the.gakuen@gmail.com まで📧【FC ŠVABOスポンサー様一覧】英語攻略.comhttps://eigokoryaku.com/オンライン英会話スクールを探している人が、自分の目的に合ったスクールを素早く見つける事が出来るように、スクールをいろいろなタイプ別に分類し紹介しています。FC ŠVABOのユニフォームスポンサーです。G&Gメディカルグループhttps://koiwanagu.wixsite.com/my-site篠崎整骨院、江戸川名倉整骨院、小岩名倉総武整骨院の3店舗を江戸川区で経営。メディカルトレーナーとしてFC ŠVABOをサポートしてくれています。Aruga（電子版スポーツノート）https://aruga.site/選手の自ら考える力を育みパフォーマンスを向上させるツール「Aruga」。コーチは紙の管理から解放されより指導に専念。選手は目標設定と振り返りが継続し、自走して成長していきます。FC ŠVABOにArugaを無料で提供してくださっています。------------------------------------------------------------------------------------------------------------------------------------------------------Leo the football へのお仕事のオファーはこちらまで💁‍♀️leothe.to.shigoto@gmail.comマネージャーが法人・個人問わず真剣に対応させて頂きますtwitter ➡️@SoccerRapperLeo(https://twitter.com/SoccerRapperLeo)TikTok➡︎ https://www.tiktok.com/@leothefootball?lang=ja-JP&is_copy_url=1&is_from_webapp=v1(画像は著作権法３２条１項に関する規定に基づき引用が許されるすべての要件を満たす場合のみ使用しており、掲載元はGetty images/Wyscoutとなります)"
"Ra9AQZFHo8M","初めまして！YouTube始めます！","2022-11-09T10:00:14Z","UCHLq9zwjFBuUdSdg0yeqnUw","せりな【格闘家】","22","22.15.11","[none]","482569","0","0","961","https://i.ytimg.com/vi/Ra9AQZFHo8M/default.jpg","False","True","instagramhttps://instagram.com/052sr?igshid=YmMyMTA2M2Y=お仕事の依頼はこちらinfo@mikuru-asakura.jp"
"Ku6cL_VQvmI","King & Prince、F1日本グランプリを徹底取材。｜はじめてのF1 Episode.1 【Hondaハート】","2022-11-10T12:00:20Z","UC74rufV9sOK7FbiOuGAUfBA","本田技研工業株式会社 (Honda)","2","22.15.11","ホンダ|Honda|UC74rufV9sOK7FbiOuGAUfBA|CM|King & Prince|キンプリ|きょう|だれかを|うれしくできた？|企業広告|ホンダハート|Hondaハート|ハート|キングアンドプリンス|平野紫耀|髙橋海人|岸優太|ティアラ|オスティアラ|デジタル動画|ドニー・トランペット＆ザ・ソーシャル・エクスペリメント|サンデイキャンディー|チャンスザラッパー|2022 FIA F1世界選手権シリーズ Honda日本グランプリレース|F1|F1日本グランプリ","305256","0","0","0","https://i.ytimg.com/vi/Ku6cL_VQvmI/default.jpg","True","True","Hondaハート　スペシャルムービーKing & Princeの5人が、3年ぶりのF1日本グランプリを徹底取材！レースの舞台は、世界中から愛される鈴鹿サーキット。オラクル・レッドブル・レーシング と スクーデリア・アルファタウリのガレージに潜入します。そして、日本が世界に誇るレーシングドライバー佐藤琢磨選手も登場！/ / / / / /現在公開中のスペシャルムービー「ホンダ・レーシング」を取材した際に「生でF1のレースを見てみたい」とメンバーから声があがったことから、鈴鹿サーキットで開催された「 F1日本グランプリ」への取材が実現。F1日本グランプリに初めて訪れるKing ＆ Princeが「Hondaハート」のメッセンジャーとしてレースにかけるHondaの熱い想いを伝えるムービーとなっています。・King & Prince の3人がF1エンジンに大興奮！ホンダ・レーシングに潜入 第1章https://www.youtube.com/watch?v=YcCrz968VXs・King & Princeの3人がGTマシンの秘密に迫る！ホンダ・レーシングに潜入 第2章https://www.youtube.com/watch?v=yILp_Xfr2SI&t=3s・King & Princeの3人がF1技術で創る未来に感動！ホンダ・レーシングに潜入 第3章https://www.youtube.com/watch?v=mZaZYwuSoJ4&t=1s/ / / / / /役に立つこと。ワクワクすること。Hondaはどっちも創りたい。https://www.honda.co.jp/HondaHeart/?utm_source=youtube&utm_campaign=2211hondaheart_pcsp#きょうだれかをうれしくできた#Hondaハート出演者・ナレーター：King & Prince　平野紫耀、永瀬 廉、髙橋海人、岸優太、神宮寺 勇太アーティスト：Donnie Trumpet & the Social Experiment楽曲：Sunday Candy▼Hondaハート公式アカウントTwitter：https://twitter.com/HondaHeart_JPInstagram：https://www.instagram.com/hondaheart_jp"
