video_id,title,publishedAt,channelId,channelTitle,categoryId,trending_date,tags,view_count,likes,dislikes,comment_count,thumbnail_link,comments_disabled,ratings_disabled,description
"ckMj575nEGo","LIVE: Full Cristiano Ronaldo interview Part 1 | 16-Nov-22","2022-11-16T21:02:50Z","UCatt7TBjfBkiJWx8khav_Gg","Piers Morgan Uncensored","24","22.17.11","ronaldo|piers morgan|cristiano ronaldo|piers morgan cristiano ronaldo|ronaldo interview|ronaldo piers morgan|ronaldo interview full|ronaldo interview piers morgan|cristiano ronaldo interview|cristiano ronaldo interview piers morgan|cristiano ronaldo piers morgan|cristiano ronaldo full interview|piers morgan ronaldo|piers morgan cristiano ronaldo interview|piers morgan ronaldo full interview|manchester united|gary neville|talksport|news|talktv|talk tv|talkradio","3317089","0","0","6624","https://i.ytimg.com/vi/ckMj575nEGo/default.jpg","False","True","Cristiano Ronaldo sensationally lifts the lid on his return to Manchester United, how he's been treated by the club and how the club has 'betrayed' him in the most explosive interview of the year with Piers Morgan.Cristiano Ronaldo reveals to Piers Morgan Uncensored that he came very close to joining United's arch rivals Manchester City in 2021. Piers Morgan also asks Ronaldo about whether he has been betrayed by Manchester United and the Portuguese opens up on the lack of progress at Old Trafford since the days of Sir Alex Ferguson.In a stream of bombshell revelations Ronaldo criticises previous managers, fellow players in the first team squad and shows his vulnerable side by telling Piers Morgan about the death of his infant son.Watch part two of 90 Minutes With Ronaldo on Piers Morgan Uncensored at 8pm on Thursday 17th November on TalkTV.Subscribe to stay up-to-date on all Uncensored content.Follow Piers Morgan Uncensored on:Twitter: https://twitter.com/PiersUncensoredInstagram: https://www.instagram.com/piersmorgan...Facebook: https://www.facebook.com/piersmorganu...TikTok: https://www.tiktok.com/@piersmorganun...Follow Piers Morgan on:Twitter: https://twitter.com/piersmorganInstagram: https://www.instagram.com/piersmorganPiers Morgan Uncensored is now available on TalkTV, Fox Nation and Sky News Australia!#cristianoronaldo #piersmorgan #interview #talktv #piersuncensored #Manchesterunited"
"BdAD28gN5nA","I Built LEGO Minecraft for a Real Turtle","2022-11-16T20:00:06Z","UCkXVK-XrnwznaqYx0aKGAtg","Aquarium Info","15","22.17.11","aquarium info|aquarium info jamie|lego fish tank|lego aquarium|lego stop motion|lego|lego expensive|lego minifigure|lego minifig|lego creation|lego builder|lego ideas|lego axolotl|minecraft axolotl|minecraft lego|beach biome minecraft|turtle minecraft|turtle minecraft lego|turtle tank setup|turtle aquarium|baby turtle|baby turtle tank setup|lego minecraft|turtle egg minecraft|turtle farm","356233","0","0","1393","https://i.ytimg.com/vi/BdAD28gN5nA/default.jpg","False","True","Download the Flip app for FREE and get 30% off your first order with aquariuminfo at checkout: https://flip.shop/aquariuminfo. Thank you Flip for sponsoring this video 🙂This week, I built a Minecraft beach biome completely out of LEGO for my tiny turtle, Harry! SUBSCRIBE for a chance to win a Wetpets NANO Aquarium Kit►  https://www.youtube.com/c/AquariumInfo?sub_confirmation=1NEW VIDEOS EVERY THURSDAY!📱 FOLLOW MY SOCIALS 📱➽ Instagram - @aquariuminfo➽ TikTok - @aquariuminfoJoin me on my quest to build every underwater biome in Minecraft! Harry was jealous of my Axolotl Lucy’s Minecraft lush cave, so I decided to create his own Minecraft turtle island. I’ve had my turtle Harry since he was a tiny baby and I’d do just about anything for him!  I love creating custom Minecraft LEGO sets. We've now built and Axolotl lush cave and a Turtle beach biome, what should we build next? If you have any comments, suggestions or questions, leave them down in the comments! Also for additional content like this, video tutorials, project sneak peeks and more, follow me on Facebook and Instagram @aquariuminfo.If you're reading this you're a Super Fan!Comment Harry is MVP so I notice you 💛If you love LEGO, Minecraft, turtles and axolotls, be sure to check out my other videos: I Built LEGO Minecraft for a Real Axolotl, I Build a Fish Tank out of 10,000 LEGO, I Built Minecraft IRL for my Axolotl, Axolotl Morphs you Should Know, I Build an Underwater Tunnel for my Axolotl, I Took my Axolotl to the Vet, I Made a SpongeBob Squarepants portal, I Built Bikini Bottom in a Fish Tank, I Made a Squidward Tentacles Portal, I made a Mr Krabs Portal, I Made a Mr Beast Portal, I Built the Krusty Krab for a Real Crab, Kirby."
"ioFXZZN6jQc","Valiant - Scholar (Official Video)","2022-11-17T00:00:08Z","UCY_rCaaNn5XxbDmKB1x-JQg","ValiantMusicVEVO","10","22.17.11","Valiant|dancehall|reggae|onerpm|Music|official|audio|video|jamaica|reggae music|dancehall 2022 mix|new music|trop life|ONErpm|dancehall music|music|reggae 2022|trending|jamaican|caribbean music|trinidad and tobago|trap|best dancehall|trending music|YouTube music","330342","0","0","3170","https://i.ytimg.com/vi/ioFXZZN6jQc/default.jpg","False","True","Official Music Video For “Scholar” Performed By ValiantStream/Download #SCHOLARhttps://onerpm.link/valiant-scholarProd By: @Damage MusiqLabel: Damage Musiq GroupVisuals: @KhingCamFollow #Valiant⤵https://instagram.com/Valiant_Musichttps://twitter.com/valiant__musicFollow Damage Musiqhttps://linktr.ee/damagemusiq#damagemusiq #valiant #reggaehttp://vevo.ly/pWvfzi"
"DMDzVb9j148","ENTRAÎNEMENT ET ÉPREUVES EN FAMILLE POUR LE FRANCE ESPAGNE - adidas football test","2022-11-16T20:18:55Z","UCNigJTVnMU8F3n08pYz0UYw","Aminematue","24","22.17.11","[none]","405135","0","0","870","https://i.ytimg.com/vi/DMDzVb9j148/default.jpg","False","True","➜ Twitch : https://twitch.tv/AmineMaTue ➜ Instagram : https://www.instagram.com/aminematue➜ Twitter : https://twitter.com/AmineMaTue➜ Discord : https://discord.gg/aminematuePensez à liker et à vous abonner si vous avez aimé !"
"C2YSX4sV_bA","Gucci Mane - Letter to Takeoff [Official Music Video]","2022-11-15T17:00:08Z","UCSugZEYrWbzqIWGD195V-YA","Gucci Mane","10","22.17.11","officialguccimane|gucci mane|gucci|mane|atlantic records|guwop|radric davis|hip hop|rap|i get the bag|solitaire|real rich|el gato|mr. davis|atlanta|the new 1017|gucci mane 1017|1017|1017 label|1017 records|so icy gang|so icy gang vol. 1|so icy gang vol 1|big scarr|foogiano|pooh shiesty|enchanting|shiesty season|big grim reaper|ice daddy","1717710","0","0","8709","https://i.ytimg.com/vi/C2YSX4sV_bA/default.jpg","False","True","Gucci Mane - Letter to TakeoffDownload/Stream - https://guccimane.lnk.to/lettertotakeoffSubscribe for more official content from Gucci Mane:https://Atlantic.lnk.to/GMsubscribeFollow Gucci ManeWebsite: https://guccimane.lnk.to/OfficialWebsiteTwitter: https://guccimane.lnk.to/TwitterFacebook: https://guccimane.lnk.to/FacebookInstagram: https://guccimane.lnk.to/InstagramSpotify: https://guccimane.lnk.to/SpotifyApple Music: https://guccimane.lnk.to/AppleMusicFollow The New 1017Website: https://www.thenew1017records.com/Instagram: https://thenew1017.lnk.to/InstagramFacebook: https://thenew1017.lnk.to/FacebookYoutube: https://thenew1017.lnk.to/YoutubeSoundCloud: https://thenew1017.lnk.to/SoundcloudGIPHY: https://thenew1017.lnk.to/GiphyThe official YouTube channel of Atlantic Records artist Gucci Mane. Subscribe for the latest music videos, performances, and more."
"yssXUmkXNOQ","SCH - Niobe (Clip officiel)","2022-11-16T18:00:08Z","UCeBu6AFsaPVElhFzlj5hetg","SCH","10","22.17.11","[none]","842866","0","0","2016","https://i.ytimg.com/vi/yssXUmkXNOQ/default.jpg","False","True","SCH « Niobe »Nouveau single disponible partout : https://s-c-h.lnk.to/niobeAYExtrait de « Autobahn », Nouvelle Mixtape le 18 Novembre. Disponible en précommande : https://s-c-h.lnk.to/D2CautobahnAY-Réalisé par : ZavenDirection Artistique : Axelle Gomila Produit par : Digital Nak"
"_qHHczHsLCo","JENNIE Reveals Her Biggest Cheerleader & Life As A BLACKPINK Girl | Ask Me Anything | ELLE","2022-11-16T13:00:33Z","UCV8Do0nwSrYP7lwPBS4LWpw","ELLE","24","22.17.11","elle|elle magazine|elle video|elle magazine videos|elle ask me anything|ask me anything elle|#askmeanything elle|elle #askmeanything|ask me anything|#askmeanything|elle ask me anything questions|ask me anything questions elle|jennie ask me anything|ask me anything jennie|elle jennie|jennie elle|jennie|blackpink|elle korea|blackpink jennie|jennie solo|JENNIE|jennie interview in english|jennie interview|jennie kim|jennie kim blackpink|jenni|black pink","1141338","0","0","4137","https://i.ytimg.com/vi/_qHHczHsLCo/default.jpg","False","True","For #JENNIE, singing, dancing, and performing with her #BLACKPINK girls is easy- but deciding what three things she can't live without is where things start to get hard. JENNIE has quickly made a name for herself in the world of fashion, and as #ELLE's cover star, it's only necessary we showcase her diverse skillset. On this episode of #AskMeAnything, discover the artist's comfort food, the thing she is most proud of, and the place she calls home. Follow JENNIE on IG: https://www.instagram.com/jennierubyjane/?hl=enELLE SHOWS: LATEST SEASON OF SONG ASSOCIATION: https://www.youtube.com/watch?v=Jc8UR... WATCH ALL SEASONS OF SONG ASSOCIATION HERE: https://www.youtube.com/c/ELLE/playlistsWaking Up With: https://www.youtube.com/watch?v=4tC2-... Thirst Trap: https://www.youtube.com/watch?v=5Bmp-... Ask Me Anything: https://www.youtube.com/watch?v=DV_EZ... The Clothes of Our Lives: https://www.youtube.com/watch?v=i7xp9... Mama, I Made It: https://www.youtube.com/watch?v=dEVNt... Read us at: https://www.elle.com Like us on Facebook: http://facebook.com/ELLEMagazine Follow us on Twitter: http://twitter.com/ELLEMagazine"
"pBIGdw-BRxw","Magic Mike’s Last Dance | Official Trailer","2022-11-15T17:00:39Z","UCjmJDM5pRKbUlVIzDYYWb6g","Warner Bros. Pictures","1","22.17.11","ayub khan din|channing tatum|jemelia george|juliette motamed|magic mike 3 trailer|magic mike last dance|magic mike last dance official trailer|magic mike last dance trailer|magic mike trailer|salma hayek|stephen soderbergh|vicki pepperdine|warner bros|wb","2952972","0","0","627","https://i.ytimg.com/vi/pBIGdw-BRxw/default.jpg","False","True","Just in time for Valentine’s Day comes the third installment of the blockbuster “Magic Mike” film franchise, the musical comedy “Magic Mike’s Last Dance.” The creative team behind the first film, which garnered praise from critics and audiences alike, has reunited to create the magic again: Channing Tatum reprises his role as Mike Lane and Steven Soderbergh returns to the helm with a script from Reid Carolin, who also wrote the first two films. And starring alongside Tatum is Salma Hayek Pinault (“House of Gucci,” “Hitman’s Wife’s Bodyguard”).“Magic” Mike Lane (Tatum) takes to the stage again after a lengthy hiatus, following a business deal that went bust, leaving him broke and taking bartender gigs in Florida. For what he hopes will be one last hurrah, Mike heads to London with a wealthy socialite (Hayek Pinault) who lures him with an offer he can’t refuse…and an agenda all her own. With everything on the line, once Mike discovers what she truly has in mind, will he—and the roster of hot new dancers he’ll have to whip into shape—be able to pull it off?The film’s producers are Nick Wechsler, Gregory Jacobs, Tatum, Carolin and Peter Kiernan. Julie M. Anderson serves as executive producer.Also starring with Tatum and Hayek Pinault are Ayub Khan Din (“Ackley Bridge”), newcomer Jemelia George, Juliette Motamed (“We Are Lady Parts”) and Vicki Pepperdine (“Johnny English Strikes Again”).Soderbergh’s creative team behind the scenes includes production designer Pat Campbell (“The Bastard Son & The Devil Himself”), costume designer Christopher Peterson (“The Irishman”) and music supervisor Season Kent (“KIMI,” “Let Them All Talk”), with choreography by Alison Faulk and Luke Broadlick, both part of the “Magic Mike” franchise.A Warner Bros. Pictures Presentation, “Magic Mike’s Last Dance” slides into theaters only in North America on February 10, 2023 and internationally beginning 8 February 2023, and will be distributed worldwide by Warner Bros. Pictures"
"caVoqAfdkYQ","Do these mental health products even do anything?","2022-11-14T18:47:58Z","UCTSRIY3GLFYIpkR2QwyeklA","Drew Gooden","23","22.17.11","drew gooden|comedy|commentary|reaction|vine|drew gooden vine|road work ahead guy|parody|rant|cringe","2200836","0","0","8886","https://i.ytimg.com/vi/caVoqAfdkYQ/default.jpg","False","True","This video is sponsored by HelloFresh. For 70% off HelloFresh plus FREE shipping, use my code IMALITTLESTINKER70 at https://bit.ly/3Nn66HV!00:00 - the cove03:04 - the ads11:22 - the unboxing couch23:15 - the results39:24 - the rest of the videomerch:https://www.drewgoodenshop.com/follow me:twitter - https://www.twitter.com/drewisgoodeninstagram - https://www.instagram.com/drewisgooden"
"dAQBo9BGRdA","Pokémon Scarlet & Pokémon Violet – Overview Trailer – Nintendo Switch","2022-11-15T14:00:31Z","UCGIY_O-8vW4rfX98KlMkvRg","Nintendo of America","20","22.17.11","nintendo|game|gameplay|fun|video game|action|adventure|rpg|play|switch|nintendo switch","1377134","0","0","5226","https://i.ytimg.com/vi/dAQBo9BGRdA/default.jpg","False","True","Learn about the world of Pokémon Scarlet & Pokémon Violet, including different features of the new open-world experience, Pokémon and Trainers you’ll meet, and more! Begin your adventure in the Paldea region when Pokémon Scarlet & Pokémon Violet release on November 18th!  #PokemonScarletViolet #NintendoSwitch https://scarletviolet.pokemon.com/en-us/Subscribe for more Nintendo fun! https://goo.gl/HYYsotVisit Nintendo.com for all the latest! http://www.nintendo.com/Like Nintendo on Facebook: http://www.facebook.com/NintendoFollow us on Twitter: http://twitter.com/NintendoAmericaFollow us on Instagram: http://instagram.com/NintendoFollow us on Pinterest: http://pinterest.com/Nintendo"
"mSe8eAelUmQ","Les Bleus sont à Doha, le film de la journée, Equipe de France I FFF 2022","2022-11-16T23:10:43Z","UCeJlXGyEl7kBgQJKADAHM3A","Fédération Française de Football","17","22.17.11","FFF|FFF TV|Equipe de France|les bleus|french|french team|soccer|football|voyage|travel|world cup|deschamps|benzema|inside|avion|trip|qatar|fifa|doha|exclusif","484660","0","0","1009","https://i.ytimg.com/vi/mSe8eAelUmQ/default.jpg","False","True","Les images exclusives du voyage des Bleus de Didier Deschamps entre Clairefontaine et Doha au Qatar. La France débutera sa Coupe du Monde 2022 mardi contre l'Australie.--------------------------------------------------------------------------------------------FFF : https://www.fff.frFacebook : https://www.facebook.com/fffTwitter :  https://www.twitter.com/FFFEQUIPES DE FRANCE : https://www.fff.fr/equipes-de-france Facebook :  https://www.facebook.com/equipedefranceSnapchat :  http://po.st/SnapchatEdFTwitter :  https://www.twitter.com/equipedefrance  Instagram :  https://www.instagram.com/equipedefrance Coupe de France : https://www.fff.fr/coupes Facebook :  https://www.facebook.com/coupedefranc... Twitter :  https://www.twitter.com/coupedefrance CHAMPIONNAT NATIONAL : http://po.st/yTSGBt Facebook : https://www.facebook.com/nationalFFF  CNF CLAIREFONTAINE :  http://www.cnf-clairefontaine.com Facebook :  https://www.facebook.com/fffTwitter :  https://www.twitter.com/FFF--------------------------------------------------------------------------------------------La Fédération Française de Football (F.F.F.) est une association loi de 1901 qui a pour mission:- d'organiser la pratique du football, sous toutes ses formes;- d’établir les règles techniques;- de délivrer les titres et gérer les sélections nationales;- de procéder à la délivrance des licences;- de définir et de mettre en œuvre un projet global de formation;- de défendre les intérêts du football français.#fiersdetrebleus"
"vFRM9ZoOPlU","THE MOST OFFENSIVE SIDEMEN AMONG US EVER","2022-11-16T18:30:52Z","UCh5mLn90vUaB1PbRRx_AiaA","MoreSidemen","22","22.17.11","sidemen|moresidemen|miniminter|ksi|zerkaa|behzinga|tbjzl|vikkstar|wroetoshaw","2553147","0","0","2216","https://i.ytimg.com/vi/vFRM9ZoOPlU/default.jpg","False","True","🍗: Order food NOW at: https://www.eatsides.com/🎥: Access exclusive content at: https://www.sideplus.com/🍹: XIX Vodka: https://www.xixvodka.com/👉🏻: Subscribe to our Reacts Channel: https://www.youtube.com/SidemenReacts 👈🏻👕: Sidemen Clothing: https://www.sidemenclothing.com📸: Sidemen Instagram: http://www.instagram.com/Sidemen🐤: Sidemen Twitter: http://www.twitter.com/Sidemen▶️ SIDEMEN ◀️🔵 JOSH (Zerkaa)● http://www.youtube.com/Zerkaa● http://www.youtube.com/ZerkaaPlays● http://www.instagram.com/Zerkaa● http://www.twitter.com/ZerkaaHD🔴 HARRY (W2S)● http://www.youtube.com/W2S● http://www.youtube.com/W2SPlays● http://www.instagram.com/Wroetoshaw● http://www.twitter.com/Wroetoshaw🔵 VIK (Vikkstar123)● http://www.youtube.com/Vikkstar123● http://www.youtube.com/Vikkstar123HD● http://www.youtube.com/VikkstarPlays● http://www.instagram.com/Vikkstagram● http://www.twitter.com/Vikkstar123🔴 JJ (KSI)● http://www.youtube.com/KSI● http://www.youtube.com/KSIOlajidebtHD● http://www.instagram.com/KSI● http://www.twitter.com/KSIOlajidebt🔵 TOBI (Tobjizzle)● http://www.youtube.com/TBJZL● http://www.youtube.com/Editingaming● http://www.instagram.com/Tobjizzle● http://www.twitter.com/Tobjizzle🔴 ETHAN (Behzinga)● http://www.youtube.com/Behzinga● http://www.youtube.com/Beh2inga● http://www.instagram.com/Behzingagram● http://www.twitter.com/Behzinga🔵 SIMON (Miniminter)● http://www.youtube.com/Miniminter● http://www.youtube.com/MM7Games● http://www.instagram.com/Miniminter● http://www.twitter.com/MiniminterEdited by CHiPFAT: https://twitter.com/CHIPFAT_"
"pRPL29zD-Sk","Best Duct Tape Art Wins $5,000!","2022-11-15T14:57:43Z","UCPAk4rqVIwg1NCXh61VJxbg","ZHC Crafts","24","22.17.11","[none]","751219","0","0","2273","https://i.ytimg.com/vi/pRPL29zD-Sk/default.jpg","False","True","We made art out of duct tape! Watch until the end to see who wins!Check out our merch: https://zhcstore.com/Check out our guest Ryanhttps://www.youtube.com/@RMDSubscribe or else╔═╦╗╔╦╗╔═╦═╦╦╦╦╗╔═╗║╚╣║║║╚╣╚╣╔╣╔╣║╚╣═╣ ╠╗║╚╝║║╠╗║╚╣║║║║║═╣╚═╩══╩═╩═╩═╩╝╚╩═╩═╝Follow these!Instagram - https://www.instagram.com/zhcTwitter - https://twitter.com/zhc_ytFacebook - https://www.facebook.com/ZHC"
"Y9A4Zm2MY8U","Jay Leno's Employee Gives Update On Jay Leno’s Burns","2022-11-14T21:42:34Z","UCiKGMZZmZXK-RpbKJGXgH3Q","Access","24","22.17.11","jay leno|news|lifestyle|Celebrity News|Celebrity Entertainment|Celebrity Entertainment News|Newest Celebrity News|Celebrity Interviews|Entertainment News|Entertainment|Recent News|Social Media News|Social Media Posts|Celebrity Scandals|Access Hollywood News|Access Hollywood Celebrity News|Access Hollywood Newest News|Access Hollywood Entertainment|Access Hollywood Entertainment News","674371","0","0","524","https://i.ytimg.com/vi/Y9A4Zm2MY8U/default.jpg","False","True","Jay Leno is on the mend. George Swift, a longtime employee and friend of the comedian, gave Access Hollywood an update on Leno, sharing that he's going to be just fine and the incident was not life threatening. George, who has worked for Leno for 15 years, also explained what happened in Leno's garage that left him with serious burns.» SUBSCRIBE: http://bit.ly/AHSub» Visit Our Website: http://www.AccessOnline.com/Get More Access Hollywood:Facebook: https://www.facebook.com/AccessOnlineTwitter: https://twitter.com/accessonlineInstagram: http://instagram.com/accessonlineSnapchat: OfficialAccessAbout Access Hollywood:Access Hollywood is a nationally syndicated daily entertainment news show. Access Hollywood delivers the most comprehensive coverage of entertainment news and personalities on television, featuring in-depth celebrity interviews and behind-the-scenes accounts of the most important events in Hollywood.Jay Leno's Employee Gives Update On Jay Leno’s Burnshttps://www.youtube.com/AccessOnline#AccessHollywood #JayLeno"
"5mTHyZqQ-QY","I Played Pokémon as an Electric Gym Leader","2022-11-15T16:57:59Z","UCnepIUw_tvOatokJAB1yipA","MandJTV Plays","20","22.17.11","mandjtv|mandjtv pokevids|gameplay|let's play|pokemon|pokemon sword and shield|pokemon sword|pokemon shield|gen 8|new pokemon|pokemon let's play|playthrough|best pokemon|all pokemon|nintendo pokemon|original pokemon|pikachu|greninja|charizard|pokemon switch|brilliant diamond|shining pearl|legends arceus|pokemon legends arceus|scarlet violet|gym leader|electric gym leader|if i was a gym leader|nintendo switch","425584","0","0","1642","https://i.ytimg.com/vi/5mTHyZqQ-QY/default.jpg","False","True","Install Raid for Free ✅ Mobile and PC: https://clik.cc/S90qp and get a special starter pack 💥 Available only for the next 30 days I played Pokemon as Galar's first Electric type gym leader!📽️Subscribe here! http://bit.ly/mandjtv_plays👕Merch store! https://mandjtvmerch.com/💸Support me on Patreon and get perks! http://bit.ly/mandjtv_patreon▶️Main Pokemon Channel! http://bit.ly/mandjtv_sub📱 TikTok! http://bit.ly/mandjtv_tiktok📸Instagram! http://bit.ly/mandjtv_insta👽Reddit! http://bit.ly/mandjtv_reddit🏪Amazon Storefront! http://bit.ly/mandjtv_shopEdited by Katie RoseMytey subscribe animation by Spoody: https://www.youtube.com/channel/UCtT-Ff9o7Ygj0dUu8wGiXcw"
"lTOzdYrXhQU","ON JOUE UN TOURNOI FIFA SPÉCIAL COUPE DU MONDE (ft. plein de monde)","2022-11-15T15:56:13Z","UCCFqUJYKT97UerMmb6DM0bw","GOTAGA","20","22.17.11","FR|gotaga|gotag4|the french monster|vitality|mygotaga","593601","0","0","345","https://i.ytimg.com/vi/lTOzdYrXhQU/default.jpg","False","True","Pour le lancement du mode Coupe du Monde sur FIFA, on a organisé un tournoi entre nous pour savoir qui sera le meilleur !Merci à Soprano, Hakim Jemili, Roman Frayssinet, Yvick, Squeezie, Doigby & Amine pour leur présence lors du live 😁💻 Passe ta commande Lenovo avec le code GOTAGA : https://lenovo.evyy.net/c/3524068/1367637/3784🎧 Steelseries t'offre 12%, code GOTAGA12: https://fr.steelseries.com/gaming-headsets/arctis-pro🎮 Scuf t'offre 5% avec le code GOTAGA : http://scuf.co/Gotaga📱 Rhinoshield t'offre 5% avec le code GOTA : https://bit.ly/GotagaxRhinoShield🕹️ Kinguin t'offre 8% avec le code GOTAGA : https://kingu.in/gotaga👕 Nouvelle collection disponible : https://shop.gotaga.tv/🏅 Quersus t'offre 5% avec le code GOTAGA : http://bit.ly/3sKtsOLTimecodes : 00:00 Introduction 00:30 Présentation des invités04:56 Le format du tournoi et les matchs06:55 Quiz11:35 Sélection des équipes13:35 1er match : Gotaga vs Mister V19:44 2ème match : Squeezie vs Soprano23:32 3ème match : Hakim vs Doigby27:44 4ème match : Roman vs Amine37:27 1ère demi-finale43:35 2ème demi-finale45:30 Finale52:00 Match entre Squeezie et Mister V56:50 Outroduction--------------------------------------------► Site Web : http://www.gotaga.tv► Boutique : https://shop.gotaga.tv/► Chaine secondaire : https://www.youtube.com/user/mYGotaga► Stream : http://www.twitch.tv/Gotaga► Discord : https://discord.gg/gotaga► Twitter : http://www.twitter.com/Gotaga► Instagram : http://www.instagram.com/Gotaga► Tiktok : https://www.tiktok.com/@gotaga► Facebook : http://www.facebook.com/Gotag4--------------------------------------------► Règles de l'espace commentaire :- Soyez respectueux envers les membres de la communauté.- Les insultes, propos racistes ou autres seront sanctionnés par l'équipe de modération.- Pas de pubs et de spams.--------------------------------------------💥 Télécharge l'extension (Chrome & Firefox), tu seras informé de la sortie de chaque vidéo sur la chaîne principale et secondaire ainsi que de mes lives :  https://gotaga.tv/extension/--------------------------------------------► Contact : contact@gotaga.tv--------------------------------------------© GOTAGA PROD"
"JZEsmQRLxy0","Ronald does SIS vs BRO Q&A","2022-11-15T16:29:32Z","UCfjLwqL4XSPUDT7hVnViCmw","RonaldOMG","24","22.17.11","sisvsbro Q&A|sis vs bro|sis vs bro questions|SISvsBRO|ronaldomg","1069434","0","0","5151","https://i.ytimg.com/vi/JZEsmQRLxy0/default.jpg","False","True","Your questions answered! SISvsBRO Q & A with RonaldSubscribe to RonaldOMG - http://bit.ly/ronaldomg Subscribe to SIS vs BRO - http://bit.ly/sisvsbro https://www.instagram.com/ronaldkurzawa/"
