video_id,title,publishedAt,channelId,channelTitle,categoryId,trending_date,tags,view_count,likes,dislikes,comment_count,thumbnail_link,comments_disabled,ratings_disabled,description
"4YkzzhI2EoI","Xi Jinping confronts Justin Trudeau at G20 over 'leaked' conversation details","2022-11-16T17:11:18Z","UCIRYBXDze5krPDzAEOxFGVA","Guardian News","25","22.17.11","canada china relations|china canada|g20|gdnpfpnewsworld|guardian g20|guardian news|justin trudea g20|justin trudeau|trudeau g20|trudeau leaks|trudeau xi|world|xi jinping|xi jinping g20|xi jinping justin trudeau|xi jinping leaks","1403300","0","0","6359","https://i.ytimg.com/vi/4YkzzhI2EoI/default.jpg","False","True","China's president, Xi Jinping. confronted the Canadian prime minister, Justin Trudeau, at the G20 leaders' summit in Bali, Indonesia. Subscribe to Guardian News on YouTube ► http://bit.ly/guardianwiressubThe Guardian publishes independent journalism, made possible by supporters. Contribute to The Guardian today ► https://bit.ly/3uhA7zgSign up to the Guardian's free new daily newsletter, First Edition ► http://theguardian.com/first-editionWebsite ► https://www.theguardian.comFacebook ►https://www.facebook.com/theguardianTwitter ► https://twitter.com/guardianInstagram ► https://instagram.com/guardianThe Guardian on YouTube:The Guardian ► https://bit.ly/guardiannewssubsGuardian Australia ► https://bit.ly/guardianaussubsGuardian Football ► https://bit.ly/gdnfootballsubsGuardian Sport ► https://bit.ly/gdnsportsubsGuardian Live ► https://bit.ly/guardianlivesubs#China #G20 #News #XiJinping"
"CMLD0Lp0JBg","Artemis I Launch to the Moon (Official NASA Broadcast) - Nov. 16, 2022","2022-11-16T09:36:21Z","UCLA_DiR1FfKNvjuUpBHmylQ","NASA","28","22.17.11","[none]","8367111","0","0","0","https://i.ytimg.com/vi/CMLD0Lp0JBg/default.jpg","True","True","Watch live as our mega Moon rocket launches an uncrewed Orion spacecraft on a 26-day mission around the Moon and back to Earth. NASA is targeting Wednesday, Nov. 16, for the launch of the Artemis I Moon mission during a two-hour launch window that opens at 1:04 a.m. EST (0604 UTC). During #Artemis I, Orion will lift off aboard the Space Launch System (SLS) rocket, and travel 280,000 miles (450,000 km) from Earth and 40,000 miles (64,000 km) beyond the far side of the Moon, carrying science and technology payloads to expand our understanding of lunar science, technology developments, and deep space radiation.  Through Artemis missions, NASA will land the first woman and the first person of color on the Moon, paving the way for a long-term lunar presence and serving as a steppingstone to send astronauts to Mars. We are going.More: https://www.nasa.gov/artemis"
"UeKxAYVkOHE","Multiplayer Pokemon is incredible","2022-11-16T23:45:09Z","UC0VVYtw21rg2cokUystu2Dw","SmallAnt","20","22.17.11","pokemon|pokemon fire red|pokemon leaf green|frlg|firered|leafgreen|multiplayer pokemon|pokemon challenge|pokemon multiplayer","969318","0","0","1478","https://i.ytimg.com/vi/UeKxAYVkOHE/default.jpg","False","True","PLUSH IS HERE: https://www.makeship.com/products/ant-plushSo TheHunterManX made multiplayer for Pokemon FireRed/Leafgreen. I got Atsign to add some nuzlocke stuff and BAM hardest Pokemon challenge I've ever done. Thanks to @shadypenguinn for joining me :)You should watch me live on Twitch:https://twitch.tv/Smallant▶Discord: https://discord.gg/Smallant▶Twitter: https://twitter.com/Smallant▶Reddit: https://reddit.com/r/Smallant▶TikTok: https://tiktok.com/@SmallantEdited by: https://mikeremer.wixsite.com/mysite#SmallAnt #ShadyPenguinn #SoulLink"
"-cT495xKvvs","Elemental | Teaser Trailer","2022-11-17T17:00:00Z","UC_IRYSp4auq7hKLvziWVH6w","Pixar","1","22.17.11","Pixar|Disney|Disney Pixar|Pixar Movie|Animation","786684","0","0","2901","https://i.ytimg.com/vi/-cT495xKvvs/default.jpg","False","True","She’s Ember 🔥. He’s Wade💧. Welcome to Element City. Watch the new trailer for Disney and Pixar’s #Elemental and see the movie in June 2023!Check out the teaser trailer and a poster for Disney and Pixar’s “Elemental,” an all-new, original feature film set in Element City, where fire-, water-, land- and air-residents live together. The story introduces Ember, a tough, quick-witted and fiery young woman, whose friendship with a fun, sappy, go-with-the-flow guy named Wade challenges her beliefs about the world they live in. Directed by Peter Sohn, produced by Denise Ream, and featuring the voices of Leah Lewis and Mamoudou Athie as Ember and Wade, respectively, “Elemental” releases on June 16, 2023.  YouTube: https://www.youtube.com/pixar/Facebook: https://www.facebook.com/PixarElementalInstagram: https://www.instagram.com/pixarelemental/Twitter: https://twitter.com/pixarelemental"
"mMaBVfIedFw","Who Took The First Selfie ... REALLY?","2022-11-17T15:01:24Z","UC6nSFpj9HTCZ5t-N3Rm3-HA","Vsauce","24","22.17.11","[none]","317805","0","0","3403","https://i.ytimg.com/vi/mMaBVfIedFw/default.jpg","False","True","Get 50% off your first Curiosity Box with code BLACKFRIDAY: https://www.curiositybox.com/follow me: https://twitter.com/tweetsauceSOURCES:White House tour social media ban: https://abcnews.go.com/Politics/tourist-selfies-white-house/story?id=32156132Bek:https://en.wikipedia.org/wiki/Bek_(sculptor)https://egypt-museum.com/stele-of-sculptor-bek-with-his-wife-taheret/https://ib205.tripod.com/bek.htmlChauvet cave: https://en.wikipedia.org/wiki/Chauvet_CaveSelfie:https://en.wikipedia.org/wiki/Selfie“Exploring the Selfie”: https://link.springer.com/book/10.1007/978-3-319-57949-8https://blogs.getty.edu/iris/whats-the-difference-between-a-selfie-and-a-self-portrait/https://museuminabottle.com/2015/01/22/whats-the-difference-between-a-selfie-and-a-self-portrait/https://www.nytimes.com/2013/10/20/sunday-review/my-selfie-myself.htmlhttps://blog.oup.com/2013/11/selfies-history-self-portrait-photography/Chimp looking in water image: https://www.researchgate.net/figure/Juvenile-chimpanzee-playing-with-his-own-reflection-in-the-water-Apes-are-known-to_fig1_7689692Smithsonian Magazine article on Cornelius: https://www.smithsonianmag.com/smart-news/this-is-the-first-selfie-ever-180948114/Smithsonian archive page for Fitz’s selfie: https://www.si.edu/object/nmah_694883Hippolyte Bayard: https://en.wikipedia.org/wiki/Hippolyte_Bayard“Is Cereal Soup?” Vsauce video: https://www.youtube.com/watch?v=O9ak89FwYeIMV Lobethal: https://cs.wikipedia.org/wiki/M._V._LobethalMirror selfie from Ginnigan on reddit: https://i.imgur.com/zJJwQGF.pngByron extended arm selfie: https://vintagenewsdaily.com/these-amazing-self-portraits-by-joseph-byron-may-be-the-first-selfies-ever-made/Grand Duchess Anastasia Nikolaevna Romanova:https://en.wikipedia.org/wiki/Grand_Duchess_Anastasia_Nikolaevna_of_Russiahttps://pagesix.com/2017/04/25/anastasia-was-the-kardashian-of-her-day-says-broadway-star/Perkins teenage self-portrait: https://www.sciencehistory.org/historical-profile/william-henry-perkinearly selfie sticks: https://pastebin.com/Qr66ppGQByron “usie”: https://www.fastcompany.com/3026832/this-might-be-the-first-selfie-in-photographic-historyJhoane Baterna-Pateña: http://www.baterna-patena.com/Historical images re-imagined as selfies: https://www.huffpost.com/entry/historical-photo-selfies_n_4310424Vivian Maier: http://www.vivianmaier.com/instant cameras:https://en.wikipedia.org/wiki/Instant_camerahttps://www.acs.org/content/acs/en/education/whatischemistry/landmarks/land-instant-photography.htmlMichael Collins’ reverse-selfie: https://nssdc.gsfc.nasa.gov/imgcat/html/object_page/a11_h_44_6642.htmlFirst selfie-stick patent: https://patents.google.com/patent/US4530580Lester Wisbrod:https://www.youtube.com/watch?v=XSSuoZH8Gmshttps://www.vice.com/en/article/nekyq8/candid-photos-with-famous-people-by-the-unofficial-inventor-of-the-selfieHiromix:https://sabukaru.online/articles/hiromix-shaping-the-identity-of-90s-japanese-female-youthhttps://www.teenagefilm.com/archives/teen-reads/seventeen-girl-dayshttps://www.nytimes.com/1999/01/16/style/IHT-young-women-behind-the-camera-craze-in-tokyo.htmlhttp://www.photoarts.com/journal/romano/hiro/https://japanesephotoblog.wordpress.com/2015/12/03/blog-post-6-hiromix/https://www.papercoffin.com/writing/articles/coerced.htmlhttps://en.wikipedia.org/wiki/HiromixFirst camera phone picture:https://www.sfmoma.org/watch/1997-birth-of-the-camera-phone-2/“Here I Am Taking My Own Picture” (nytimes) 2006: https://www.nytimes.com/2006/02/19/fashion/sundaystyles/here-i-am-taking-my-own-picture.htmlOldest recorded use of “seflie”:https://www.dailymail.co.uk/news/article-3061118/Australia-revealed-invented-word-selfie-2000-Aussie-phrases-words-added-Oxford-Dictionaries.htmlhttps://slate.com/human-interest/2013/11/selfie-etymology-an-australian-man-takes-a-photo-of-his-lip-after-falling-down-drunk-but-he-didn-t-coin-the-word.html(archive of forum post): https://web.archive.org/web/20040117090107/http://www2b.abc.net.au/science/k2/stn/archives/archive32/newposts/169/topic169861.shtmAussie slang:https://daily.jstor.org/australians-obsessed-nicknaming/https://en.wikipedia.org/wiki/Diminutives_in_Australian_Englishhttps://www.abc.net.au/education/learn-english/australian-slang-soz-or-wuz/11335542https://thebeast.com.au/other/australian-english-a-totes-amazeballs-lingo/#“selfie” as word of the year: https://languages.oup.com/word-of-the-year/https://www.bbc.com/news/uk-24992393Anachronym: https://en.wikipedia.org/wiki/Misnomer#Anachronym“The Return of the Selfie” (New Yorker): https://www.newyorker.com/tech/annals-of-technology/the-return-of-the-selfieKardashian belfie pic: https://www.instagram.com/p/fjw59uuS7b/?utm_source=ig_embed&ig_rid=06354636-71c2-4f46-b660-6db9127561ddBelfie stick: http://belfiestick.com/ALL MUSIC BY JAKE CHUDNOW: https://www.youtube.com/jakechudnowadditional images: https://pastebin.com/ypBQHiG4"
"Gzs60iBgd3E","DUKI || BZRP Music Sessions #50","2022-11-16T22:00:12Z","UCmS75G-98QihSusY7NfCZtw","Bizarrap","24","22.17.11","bizarrap|biza|bisa|bizzarrap|bzrp|bzrp music sessions|trap|musica latina|argentina|méxico|españa|hip hop|rap|biza session|reggaeton|music session|USA|Puerto rico|el biza la soltó|el dj|España|tiago|tiago biza|latin music|mala mia|puerto rico|el biza|la 52|quedate|perreamos toda la noche|DUKI || BZRP Music Sessions #50|duko|duki|El milagro de Sandra y de Guille nacido el 24 de junio|24 de junio|bandera argentina|modo diablo|argentina en la casa","14716759","0","0","120743","https://i.ytimg.com/vi/Gzs60iBgd3E/default.jpg","False","True","DUKI || BZRP Music Sessions #50Lyrics by: https://www.instagram.com/dukiBeat by:  https://www.instagram.com/bizarrap Mix and Master by:  https://www.instagram.com/zecca.flp Shot and Edit by: https://www.instagram.com/pedro.colmeiro VFX: https://www.instagram.com/sart0riSinfónica: https://www.instagram.com/juvenilnacionalsanmartinBooking / Contacto  contacto.bizarrap@lauriaweb.com #Bizarrap #DUKI"
"YO8QFfIOrGM","AMP HELL'S KITCHEN 2","2022-11-16T23:00:27Z","UCJbYdyufHR-cxOuY96KIoqA","AMP","24","22.17.11","KAI CENAT|DUKE DENNIS|FANUM|AGENT 00|IMDAVISSS|CHRISNXTDOOR|AMP|AMP HELL'S KITCHEN|AMP HELL'S KITCHEN 2","697903","0","0","1860","https://i.ytimg.com/vi/YO8QFfIOrGM/default.jpg","False","True","SUB TO THE AMP PODCAST CHANNEL COMING SOOON https://www.youtube.com/channel/UC51ypdbMnEyRb9f9MCOg_Vg?sub_confirmation=1AMP AMP AMP AMP📸 Follow us on Instagram: https://www.instagram.com/ampexclusive🦅 Follow us on Twitter: https://twitter.com/ampexclusive⚡️⚡️AMP⚡️⚡️⚡️Fanum aka JustFanum🎥 https://www.youtube.com/c/FanumReacts/videos📸 https://www.instagram.com/elfanum/🦅 https://twitter.com/FanumTV⚡️Duke aka Duke Dennis🎥 https://www.youtube.com/c/DeeBlockDukeDennis📸 https://www.instagram.com/duke_dennis/🦅 https://twitter.com/ImDukeDennis⚡️Agent aka Agent 00🎥 https://www.youtube.com/user/CallMeAgent00📸 https://www.instagram.com/callmeagentzero/🦅 https://twitter.com/CallMeAgent00⚡️Davis aka ImDavisss🎥  https://www.youtube.com/c/ItsDavisss📸 https://www.instagram.com/imdavisssyt/🦅 https://twitter.com/imdavisss⚡️ Kai aka Kai Cenat🎥 https://www.youtube.com/c/KaiCenat📸 https://www.instagram.com/kai_cenattv/🦅 https://twitter.com/KaiCenat⚡️Chris aka chrisnxtdoor🎥 https://www.youtube.com/watch?v=yEREEVk06ZM📸 https://www.instagram.com/chrisnxtdoor_/🦅 https://twitter.com/chrisnxtdoor_"
"6p4SeR3pliM","Nike FC Presents the Footballverse","2022-11-16T08:01:10Z","UCNhxq7He5p-_FdBh0OaxcQg","Nike Football","17","22.17.11","Nike|Nike commercial|Footballverse|Nike FC|Cristiano Ronaldo|Kylian Mbappe|Ronaldinho|R10|Ronaldo|R9|Alex Morgan|Virgil van Dijk|Kevin De Bruyne|Leah Williamson|Phil Foden|Carli Lloyd|Edgar Davids|Sam Kerr|Shane Kluivert|CR Jr.","3864147","0","0","5337","https://i.ytimg.com/vi/6p4SeR3pliM/default.jpg","False","True","An international team of scientists at a secret lab in Switzerland finally cracked the code. They’ve written the formula that will put an end to any discussion—the ultimate battle of all football generations... With the push of a button, they bring us legendary players from the past and present. A crazy experiment unfolds. Watch now to find out if the world of science can find a way to settle the score.A Nike FC original presented by DOCTOR ROUSSEAU and PROFESSOR MACHADO, starring CRISTIANO RONALDO, KYLIAN MBAPPÉ, RONALDO, RONALDINHO, ALEX MORGAN, VIRGIL VAN DIJK, SAM KERR, KEVIN DE BRUYNE, LEAH WILLIAMSON, PHIL FODEN, CARLI LLOYD, CR JR., SHANE KLUIVERT and EDGAR DAVIDS. Watch the film, then explore the Footballverse for yourself. Enter to find Nike experiences near you, visit NIKELAND on Roblox, shop Nike Football, explore Mercurial by You and get your game on with Rocket League. Enter the Footballverse Experience:  http://footballverse.nike.com"
"toBTPGfurLc","Kendrick Lamar - Rich Spirit","2022-11-16T18:00:02Z","UC3lBXcrKFnFAFkfVk5WuKcQ","Kendrick Lamar","22","22.17.11","[none]","1849910","0","0","9097","https://i.ytimg.com/vi/toBTPGfurLc/default.jpg","False","True","Kendrick Lamar “Rich Spirit” Directed by CalmaticProduction Company: pgLang, PrettybirdExecutive Producers / pgLang: Kendrick Lamar, Dave FreeExecutive Producer / Prettybird: Candice Dragonas Producers: Brendan Garrett, Jamie Rabineau Director of Photography: Chris RipleyProduction Designer: Scott Falconer Choreographer: Charm La’Donna1st AD: Jey WadaStylist: Taylor McNeillEditor: Grason Caldwell @ ParallaxColor: Michael Rossiter @ Rare MediumVFX: The Mill Commissioner: Michelle AnThank you to our team at pgLangKendrick Lamar “Mr. Morale & The Big Steppers” is available now: https://KendrickLamar.lnk.to/MrMoralehttps://oklama.comhttps://www.instagram.com/kendricklamarhttps://twitter.com/kendricklamarhttps://www.facebook.com/kendricklamar#KendrickLamar #RichSpirit #MrMorale #TheBigSteppers"
"TfaMLqEh1qM","Brendan Fraser Breaks Down His Most Iconic Characters | GQ","2022-11-16T17:00:09Z","UCsEukrAd64fqA7FjwkmZ_Dw","GQ","1","22.17.11","bedazzled|brendan fraser|brendan fraser encino man|brendan fraser films|brendan fraser funny|brendan fraser gq|brendan fraser iconic characters|brendan fraser interview|brendan fraser movies|brendan fraser mummy|brendan fraser the mummy|brendan fraser the whale|celebrity|encino man|film|george of the jungle|gq|gq brendan fraser|gq magazine|gq moty|iconic|iconic characters|man of the year|moty|movies|school ties|the mummy|the whale","1807053","0","0","6968","https://i.ytimg.com/vi/TfaMLqEh1qM/default.jpg","False","True","Brendan Fraser breaks down a few of his most iconic characters from 'School Ties,' 'George of the Jungle,' 'Encino Man,' 'The Mummy' series, 'Bedazzled' and 'The Whale.'00:00 When the movie came out, we had no idea what it was going to be...00:34 School Ties03:35 George of the Jungle06:34 Encino Man08:45 The Mummy 1-313:53 Bedazzled17:37 The WhaleDirector: Christopher SmithDirector of Photography: Brad Wickham Editor(s): Matt BraunsdorfCelebrity Talent: Brendan Fraser Executive Producer: Traci OshiroProducer: Jean-Luc LukunkuAssociate Producer: Camille Ramos Line Producer: Jen SantosProduction Manager: James PipitoneProduction Coordinator: Jamal Colvin Talent Booking: Dana Mathews Camera Operator(s): Matthew DinneyAudio: Sean Paulsen Production Assistant(s): Rafael Vasquez Groomer: Barry WhiteAssociate Director of Post Production: Jarrod Bruner Post Production Supervisor: Rachael KnightPost Production Coordinator: Ian BryantSupervising Editor: Rob LombardiAssistant Editor: Ben HarowitzStill haven’t subscribed to GQ on YouTube? ►► http://bit.ly/2iij5wtSubscribe to GQ magazine and get rare swag: https://bit.ly/2xNBH3iJoin the GQ Discord to talk men's fashion, watches, and more: https://discord.gg/gqmagazineABOUT GQFor more than 50 years, GQ has been the premier men’s magazine, providing definitive coverage of style, culture, politics and more. In that tradition, GQ’s video channel covers every part of a man’s life, from entertainment and sports to fashion and grooming advice. Welcome to the modern guide to style advice, dating tips, celebrity videos, music, sports and more.https://www.youtube.com/user/GQVideos"
"MgxyLV31-vM","The End Of Jeffree Star and Shane Dawson","2022-11-15T22:02:41Z","UCV9_KinVpV-snHe3C3n1hvA","shane","23","22.17.11","Shane|Dawson|conspiracy|theories|journalism|investigative journalism|docuseries|documentary","1626239","0","0","12122","https://i.ytimg.com/vi/MgxyLV31-vM/default.jpg","False","True","DOOMSDAY MERCH! https://www.shanedawsonmerch.com Please SUBSCRIBE and BINGE THE WHOLE SERIES https://www.youtube.com/watch?v=s3WFAONOFhs&list=PLDs0tNoNYTz05R0xo7PCVc-RgL2fsJnGgThank you to RIDGE! Check out their wallets here!!   https://ridge.com/shaneNEW MERCH! https://www.shanedawsonmerch.com/Check out THE NEW PODCAST! https://www.youtube.com/watch?v=TCatklmGGnk&list=PLUquvWuWlOaO3a04sl86i63y6LQqn1UIxShane Dawson Podcast Channel  @Shane2   PODCAST IG https://www.instagram.com/shanedawsonpodcast/?hl=en My SNAPCHAT LOLShaneDawsonMy TikTok https://www.tiktok.com/@shanedawsonMy IG https://www.instagram.com/shanedawson/?hl=enCheck out all of my JEFFREE STAR SERIES here! https://www.youtube.com/watch?v=JWukx3HGBKI&list=PLDs0tNoNYTz05R0xo7PCVc-RgL2fsJnGgThe New World of Jeffree Star SPOTIFY PLAYLIST I made a Spotify Playlist of all the music featured in this series!https://open.spotify.com/playlist/2guWmSppQ6wvHrQ1j2ajE7?si=ZT5y1F5ZQSmaKbFo4EEOmQJeffree Star  @jeffreestar   https://www.instagram.com/jeffreestar/?hl=enhttps://www.tiktok.com/@jeffreestar Ryland’s Vlogs  @Ryland vlogs Ryland’s Main Channel  @Ryland Adams  Ryland’s Podcast   @The Sip with Ryland Adams and Lizze Gordon  Ryland’s Instagram https://www.instagram.com/rylandadams/?hl=enRyland’s Tik Tok https://www.tiktok.com/@rylandadamsChris’s Channel  @ChrisBstation Chris’s Instagram https://www.instagram.com/chrisbstation/?hl=enMaddie https://instagram.com/maddietaylorr?igshid=YmMyMTA2M2Y=Jaquline https://instagram.com/jacqueline.j?igshid=YmMyMTA2M2Y=JSChttps://jeffreestarcosmetics.com/Featured Creators:Graveyard Girl https://www.youtube.com/watch?v=U3bGRlTp9T8Bridgette Turcohttps://www.youtube.com/watch?v=vnPDoMuXlHIJake Jacob Beauty https://www.youtube.com/watch?v=ptqYWD2FVJcSam Zena https://www.youtube.com/watch?v=mOZqlKyqkgoMakeupKAThttps://www.youtube.com/watch?v=4FIp8_9kd3EChristopher JMUAhttps://www.youtube.com/watch?v=m3KR8U91nkYAixa Chttps://www.youtube.com/watch?v=MUOrcmE2rXwMyLocalRadio EVANSTONhttps://www.youtube.com/c/MyLocalRadiocomSONGSSavannah outen - The Hard Wayhttps://open.spotify.com/track/6QWgorwuWhQVlGUcIx1M8O?si=iXkGGLy9RN-U2We8zQolQgNarrowhaven - Stutterhttps://open.spotify.com/track/3LbpaaoITl5hrYVfaiJDS8?si=HT-fImvvQo6Cu4MewWkToAObi ben Yesterdayhttps://open.spotify.com/track/6aoO5WQMZdfg0tKOhZ8bFA?si=3YvoWAfwT46yVfMp-jkErAStayhttps://open.spotify.com/track/5fqdxpnGtzMxCoxT2spSd5?si=8N_rXSlWRESyeMDb6qRvpgMason Murphy Wrong directionhttps://open.spotify.com/track/66SxGyWkD0VZSb8iZxl78H?si=PXhBrnAsSkuf7neWB4nL9QMusic by Mason Murphy - Fix Myself - https://thmatc.co/?l=01053589Music by Mykyl - Wrong Direction - https://thmatc.co/?l=070FF12DMusic by Lillian Hepler - Baddie - https://thmatc.co/?l=1E2E250CMusic by Mason Murphy, Parker Rudd - Wake Me Up - https://thmatc.co/?l=8667752AMusic by Mason Murphy, Parker Rudd - Wake Me Up (Acoustic) - https://thmatc.co/?l=BD59F3B9Music by Mason Murphy, Parker Rudd - Sick Of You - https://thmatc.co/?l=3B58445BMusic by Savannah Outen - The Hard Way - https://thmatc.co/?l=E70AE228Music by Narrowhaven - Stutter - https://thmatc.co/?l=54B87CDFMusic by Narrowhaven - Sympathy - https://thmatc.co/?l=33C501B1Music by Narrowhaven - Lying to Myself - https://thmatc.co/?l=7608C6B5Music by Mykyl - Never Be - https://thmatc.co/?l=48DB86EDMusic by Mason Murphy, Parker Rudd - Wake Me Up (Acoustic) - https://thmatc.co/?l=BD59F3B9Music by Obi Ben & Faletti - Stay - https://thmatc.co/?l=2514AD9FMusic by Obi Ben - Hometown Girl - https://thmatc.co/?l=655A1E21Music by Obi Ben - yesterday - https://thmatc.co/?l=49694B9C"
"oL0umpPPe-8","Samsung’s Dangerous Dominance over South Korea","2022-11-16T15:32:56Z","UC9RM-iSvTu1uPJb8X5yp3EQ","Wendover Productions","27","22.17.11","[none]","748848","0","0","2178","https://i.ytimg.com/vi/oL0umpPPe-8/default.jpg","False","True","Sign up for a CuriosityStream subscription and also get a free Nebula subscription (the streaming platform built by creators) here: http://CuriosityStream.com/wendoverWatch Jet Lag: The Game at http://youtube.com/jetlagthegame Buy a Wendover Productions t-shirt: https://standard.tv/collections/wendover-productions/products/wendover-productions-shirtSubscribe to Half as Interesting (The other channel from Wendover Productions): https://www.youtube.com/halfasinterestingYoutube: http://www.YouTube.com/WendoverProductionsInstagram: http://Instagram.com/sam.from.wendoverTwitter: http://www.Twitter.com/WendoverProSponsorship Enquiries: wendover@standard.tvOther emails: sam@wendover.productionsReddit: http://Reddit.com/r/WendoverProductionsWriting by Sam Denby and Tristan PurdyEditing by Alexander WilliardAnimation led by Josh SherringtonSound by Graham Haerther Thumbnail by Simon BuckmasterReferences[1] https://www.eia.gov/international/rankings/world?pa=264&u=0&f=A&v=none&y=01%2F01%2F2021&ev=fals[2] https://www.statista.com/statistics/264439/oil-reserves-in-selected-countries-since-1990/[3] https://www.macrotrends.net/countries/KOR/south-korea/gdp-gross-domestic-product[4] https://medium.com/@aislingbhroin/the-korean-war-the-importance-of-a-forgotten-war-e7772b7b322[5] https://www.macrotrends.net/countries/USA/united-states/gdp-per-capita[6] https://images.samsung.com/is/content/samsung/assets/global/ir/docs/2020_Business_Report.pdf[7] https://research-doc.credit-suisse.com/docView?language=ENG&format=PDF&source_id=csplusresearchcp&document_id=1034191531&serialid=aedFqU4PFKhOIEqdnUM5dJs447EiSMsRWJSv8JjJFu4%3D&cspId=null[8] https://www.statista.com/statistics/1314374/south-korea-samsung-groups-revenue-as-a-share-of-gdp/ [9] https://fsi.stanford.edu/news/closer-look-samsung-offers-insights-south-korean-society [10] https://www.npr.org/sections/parallels/2016/04/19/474621999/to-the-list-of-high-stakes-tests-in-korea-add-the-samsung-sat [11] https://thediplomat.com/2017/03/why-samsungs-lee-jae-yong-might-have-bribed-choi-soon-sil/ [12] https://www.kjis.org/journal/view.html?spage=203&volume=3&number=1#T1 [13] https://www.piie.com/publications/chapters_preview/341/2iie3373.pdf"
"vIV8-m-iYTk","I Spent 30 Hours in Pokemon Scarlet, Here's What Happened...","2022-11-17T13:05:15Z","UCl4vHlsw4s5TVGFpVsj54Rg","Keegan J","20","22.17.11","Pokemon|Scarlet|Violet|Challenge","105625","0","0","987","https://i.ytimg.com/vi/vIV8-m-iYTk/default.jpg","False","True","I played Pokemon Scarlet and Violet for 30 hours. Here are the highlights, glitches, story and goofy moments of my adventure. ✅ SUBSCRIBE for more Pokemon challenges: https://www.youtube.com/keeganj?sub_confirmation=1▶️ PLAYLIST of MONOTYPE Pokemon Hardcore Nuzlockes: https://www.youtube.com/playlist?list=PLoKICX4PmrWWSakAHQjpUtbCE_zlPwNQ4🔴 VIDEO - Can ONE Magikarp Beat Pokemon Legends: Arceus? https://youtu.be/QE_DJ-zA2pA🌐 SOCIALS - Live on Twitch: https://twitch.tv/keeganjtv - Follow my Twitter: https://twitter.com/KeeganJtv - Join the Discord: https://discord.gg/RTKMxShMuXEdited by Luker: https://www.youtube.com/c/LukerYT#pokemon #pokemonscarletandviolet #challenge"
"PrSBuEFdRFU","Drake and 21 Savage - Rich Flex Her Loss Recap","2022-11-17T01:53:22Z","UCByOQJjav0CUDwxCk-jVNRQ","Drake","10","22.17.11","[none]","1115079","0","0","2804","https://i.ytimg.com/vi/PrSBuEFdRFU/default.jpg","False","True","‘Her Loss’ by Drake & 21 Savage available everywhere now: http://drake.lnk.to/herlossSubscribe to Drake on YouTube: http://drake.lnk.to/subscribeConnect with Drake:https://instagram.com/champagnepapihttps://facebook.com/drakehttps://twitter.com/drakehttps://www.drakerelated.com"
