video_id,title,publishedAt,channelId,channelTitle,categoryId,trending_date,tags,view_count,likes,dislikes,comment_count,thumbnail_link,comments_disabled,ratings_disabled,description
"zOFtxBhJ8wk","Grimper Le Plus Haut Mur d’Escalade AU MONDE Sans Expérience (6A+) 🧗🏽","2022-11-15T19:33:39Z","UCTAqiGK5Sjjb1IRDGYB04Zg","Tristan","24","22.17.11","pmp|experience|apprendre|escalade|grimpe|apprendre l'escalade|apprendre escalade|conseils escalade|progresser escalade|voie escalade la plus dure du monde|voie escalade|escalade voie salle|grande voie escalade|tuto escalade|escalade bloc vs voie|escalade bloc|escalade 2022|escalade en salle|cours escalade|conseil débutant escalade|grimper|apprendre a chuter en escalade|barrage luzzone dam|barrage luzzone|escalade suisse|escalade en france|spot escalade","254444","0","0","893","https://i.ytimg.com/vi/zOFtxBhJ8wk/default.jpg","False","True","► Voir le Asus ZenBook 17 Fold OLED chez ASUS : https://bit.ly/3VTSKad ► Voir le Asus ZenBook 17 Fold OLED chez FNAC : http://bit.ly/3UULlWMNewsletter PMP : www.practicemakesperfect.fr Est-il possible de grimper le plus haut mur d’escalade artificiel du Monde sans expérience ? 🧗‍♀️ Aujourd’hui dans cette nouvelle vidéo, on se dirige du côté de la Suisse Italienne pour expérimenter l’une des expériences les plus physiques réalisées sur cette chaîne… Vous me connaissez et vous savez que j’essaye de me dépasser dans tout ce que j’entreprends mais si vous me connaissez VRAIMENT vous savez que l’endurance et moi… ça fait deux. Sans parler de mon cardio de powerlifteur mdr Pour être honnête avec vous avant chaque Expériences ou PMP, je fais volontairement exprès de ne pas me renseigner sur ce qui m’attend pour le découvrir avec vous en vidéo et que toutes nos réactions soient 100% spontanées & réelles. Mais là l’information qui suit m’a tué 🥵On a déjà escaladé un immeuble sans expérience et ça m’a prit peu de temps donc je me suis dis la MAXXXXXXXXXX ça me prends 1h-2h MAXXXXXXXXXXX mais quand le guide m’annonce qu’on part pour 5 HEURES DE GRIMPE… j’étais VRAIMENT pas prêt 😭Bon… après étant donné que sur cette chaîne on apprend et on expérimente dans tous les domaines possibles, j’me dois de mener cette mission jusqu’au bout alors let’s go ! ✨Mes Buddies, j’espère que vous êtes prêts pour cette nouvelle aventure !À 66.666 pouces bleus on envoie le plus haut mur naturel du Monde ? 😅3…2…2…2…2…1… Bref, bienvenue dans cette nouvelle expérience. 💜#Experience #Escalade #PracticeMakesPerfect  Merci à Mauro et Francesco, si vous cherchez des guides monstrueux n'hésitez pas : kuberake@gmail.comLES LIENS UTILES ❤️➡️ Mon Sponsor BULK : https://bit.ly/PromosBULK 💪🏽 (code promo -45% : BUDDY)➡️ Mon Sponsor GYMSHARK : http://gym.sh/Soldes-Tristan 💪🏽   ➡️ Ma marque de vêtements PMP : https://bit.ly/PMP_ 👕 (code promo : TEAMYOUTUBE)➡️ Ma marque de THÉ BIO PMTEA : https://bit.ly/PMTEA_ 🍵      (code promo : TEAMYOUTUBE)➡️ Mon jeu de carte d'introspection : https://controlyourmind.fr/discount/BUDDY ➡️ Le livre que j'ai écris : https://bit.ly/LMF_📖  ➡️ Ton coaching par télephone : https://bit.ly/AppelleMoi__📞 ➡️ Ton programme de sport GRATUIT : https://bit.ly/ProgrammeGratuit_ 🏋🏽‍♀️"
"9zEPGHPZCF8","Ruger - Red Flags (Official Video)","2022-11-15T13:00:10Z","UCugoOHsHbbuPL9421CjxSEA","RugerVEVO","10","22.17.11","Ruger official|Ruger Official video|Ruger Red Flags|Red Flags Official|Red Flags official video|Ruger TikTok song|Ruger Dior|Ruger Bounce|Nigerian singer-songwriter|Afrobeat official|afrobeat official video|Ruger Girlfriend|Columbia|Rap/Hip-Hop|Red Flags|Ruger","883351","0","0","2299","https://i.ytimg.com/vi/9zEPGHPZCF8/default.jpg","False","True","Ruger - Red Flags (Official Video)Listen/download: https://ruger.lnk.to/RedFlags-------------Follow RugerInstagram: https://www.instagram.com/rugerofficial/Twitter: https://twitter.com/rugerofficialTikTok: https://vm.tiktok.com/ZMeg7ReNx/-------------Lyrics:Don’t know what you think this is Is it love or lust baby I don’t know which isThought I told ya can’t fulfill your wishes I’m a fucking star on every girl’s wishlist But you never for once listenedYou’re not the only one got several bitchesBut before I go take some kissesAnd never doubt the fact say I love you pieces She said Ru baby this ain’t youYou’re not the sweet guy I once knewTell what changedDid I do anything wrong Of you just don’t love me anymore She said Ru baby this ain’t youYou’re not the sweet guy I once knewWhy did you change so bad towards meYou’re treating me like shit Me tell her sayYou saw the red flags baby But you ignored the red flags Now you’re here baby you come Dey vexSee I can’t change baby you better rest Or you end this nowHuhBaby gyal no time we gotta end this nowLet’s stop lying Omo see na true talk I no fit settle down Time’s not on your sideCheck the clockI know you fell in love with my cock and Glock I’m a billion reasons why we can’t work babyShe said Ru baby this ain’t youYou’re not the sweet guy I once knewTell what changedDid I do anything wrong Of you just don’t love me anymore She said Ru baby this ain’t youYou’re not the sweet guy I once knewWhy did you change so bad towards meYou’re treating me like shit Me tell her sayYou saw the red flags baby But you ignored the red flags Now you’re here baby you come Dey vexSee I can’t change baby you better rest Or you end this now#Ruger #RedFlags #OfficialVideo"
"1Gkt-25X9ZU","So I Confused My Minecraft Live Stream…","2022-11-13T21:30:03Z","UCaawTX2yTGhd3xKwKfpXZTQ","Spifey","20","22.17.11","minecraft|mine craft|dream minecraft|funny|minecraft funny|minecraft challenge|spifey|minecraft manhunt|minecraft but|challenge|minecraft mod|modded minecraft|100 players|minecraft survival|dream smp|minecraft map|minecraft trolling|minecraft troll|so i triggered my minecraft live stream|confusing minecraft|cursed minecraft|so I confused my Minecraft live stream","469178","0","0","479","https://i.ytimg.com/vi/1Gkt-25X9ZU/default.jpg","False","True","So I Confused My Minecraft Live Stream…Follow My Twitter @SpifeyyFollow My Instagram @SpifeyFollow My Twitch: spifeyyI confused my Minecraft live stream in the best way ever! This was crazy.Minecraft has some pretty confusing things. I got all of the most confusing Minecraft things and put them in my Minecraft live stream! I also used Minecraft mods to get extra confusion into my Minecraft server. This might actually be the most confusing Minecraft stream in history - who knows! My audience had no clue about my Minecraft stream troll!Credits/Resources Used:WASD - https://wasdbuildteam.website/data-packs/Command Geek - https://www.commandgeek.com/illegal-blocksResource Packs - https://ewanhowell.com/Here is another secret video for you - https://www.youtube.com/watch?v=-0odTDUASZE"
"0Ba9nu-5ZfQ","How Good is a Premier League Keeper at Shooting?","2022-11-14T21:00:09Z","UCQ-YJstgVdAiCT52TiBWDbg","ChrisMD","24","22.17.11","[none]","1885842","0","0","813","https://i.ytimg.com/vi/0Ba9nu-5ZfQ/default.jpg","False","True","Another professional footballer I'm better at free kicks than!Ben Foster: https://www.youtube.com/c/BenFosterTheCyclingGKStephen Tries: https://www.youtube.com/c/StephenTriesCallux: https://youtube.com/Callux► Follow my Instagram: http://instagram.com/chrismd10► Follow me on Twitter: https://twitter.com/chrismd10If you want to know how I use popular music in my content - Lickd provide an affordable service to license mainstream music for use in monetised content. Save 50% off your first track on Lickd and improve your video quality with popular music: https://lickd.co/affiliate/chrismdMusic:00:01 | Get Wrecking Bar (Ra Ra Ra) by The Vaccines and over 1M + mainstream tracks here https://go.lickd.co/MusicLicense ID: An29z8RJ56D01:27 | Get Watercolour (Full Version) [Single] by Pendulum and over 1M + mainstream tracks here https://go.lickd.co/MusicLicense ID: 8p5NYbWqRqG 02:23 | Get Big City Life by Luude, Mattafix and over 1M + mainstream tracks here https://go.lickd.co/MusicLicense ID: geJNb0WBJrK08:14 | Arc North - First Light 09:15 | Max Brhon - Redemption [NCS Release]Music provided by NoCopyrightSounds.Watch: https://youtu.be/cTP5xmV5ejIFree Download / Stream: http://ncs.io/MB_RedemptionMusic by Epidemic Sound (http://www.epidemicsound.com) & others."
"apZGOhKtvxA","Welcome to The World Cup 🤩 Three Lions Arrive at SGP Ahead of 2022 FIFA World Cup | England","2022-11-15T01:19:23Z","UCNT2e7Og56vm5_V-yJWvglA","England","17","22.17.11","england|bukayo saka|three lions|inside training|england training|inside access|arrivals|st george's park|sgp|saka england|harry kane|player arrivals|england football training|england training session|england training funny moments|england training shooting|england training soccer|Ben White|James Maddison|england arrivals 2022|england arrivals trent|england player arrivals|england national team arrivals|england player arrivals world cup","1430800","0","0","2148","https://i.ytimg.com/vi/apZGOhKtvxA/default.jpg","False","True","Get a behind-the-scenes look inside St. George’s Park as the Three Lions arrive ahead of the 2022 FIFA World Cup. SUBSCRIBE to ensure you don’t miss a video from the England YouTube channel. Hit the bell to get notifications on our latest uploads! ► Subscribe: http://bit.ly/FATVSub► Twitter: http://www.twitter.com/england► Instagram: http://www.instagram.com/england► Facebook: http://www.facebook.com/englandteam► Twitch: https://www.twitch.tv/england► TikTok: https://www.tiktok.com/@england#England #ThreeLions #fifaworldcup2022"
"C342dfNPCyg","'Wings Over Dallas' Mid Air Collision Report","2022-11-15T00:24:19Z","UCphqjYZxxzjNbONVmY-0J7Q","blancolirio","28","22.17.11","[none]","793874","0","0","2620","https://i.ytimg.com/vi/C342dfNPCyg/default.jpg","False","True","LINKS:                                                                       (Correction: 37mm cannon)Flight Track Overlay: https://www.youtube.com/watch?v=KHXgjj02anAADSB Data: B-17: https://globe.adsbexchange.com/?icao=a9ae4a&lat=32.672&lon=-96.878&zoom=14.1&showTrace=2022-11-12&timestamp=1668280914P-51: https://globe.adsbexchange.com/?icao=a6e2de&lat=32.666&lon=-96.896&zoom=13.6&showTrace=2022-11-12&leg=4&timestamp=1668280905P-63: https://globe.adsbexchange.com/?icao=a8f4c3&lat=32.681&lon=-96.879&zoom=14.1&showTrace=2022-11-12&trackLabels&timestamp=1668280915P-63 Walkaround: https://www.youtube.com/watch?v=ruoDK2MlAlgPATREON: https://www.patreon.com/user?u=5295000&fan_landing=trueLearning The Finer Points: https://www.learnthefinerpoints.com/Theme: Weightless Aram Bedrosianhttps://www.arambedrosian.com"
"kX3nB4PpJko","Last To Take Hand Off Jet, Keeps It!","2022-11-12T21:00:00Z","UCX6OQ3DkcsbYNE6H8uQQuVA","MrBeast","24","22.17.11","[none]","48404404","0","0","75783","https://i.ytimg.com/vi/kX3nB4PpJko/default.jpg","False","True","Close this and watch to the end to see who wins!New Merch - https://shopmrbeast.com/At the end I said we would offset all carbon emissions but what we actually did was offset it by 10x!!SUBSCRIBE OR I TAKE YOUR DOG╔═╦╗╔╦╗╔═╦═╦╦╦╦╗╔═╗║╚╣║║║╚╣╚╣╔╣╔╣║╚╣═╣ ╠╗║╚╝║║╠╗║╚╣║║║║║═╣╚═╩══╩═╩═╩═╩╝╚╩═╩═╝----------------------------------------------------------------follow all of these or i will kick you• Facebook - https://www.facebook.com/MrBeast6000/• Twitter - https://twitter.com/MrBeast•  Instagram - https://www.instagram.com/mrbeast•  Im Hiring! - https://www.mrbeastjobs.com/--------------------------------------------------------------------"
"TGLyNcO8LcA","The movie where they go BACK IN TIME TO THE FIRST THANKSGIVING TO GET TURKEYS OFF THE MENU","2022-11-14T21:20:53Z","UC5UYMeKfZbFYnLHzoTJB1xA","Schaffrillas Productions","24","22.17.11","Schaffrillas Productions|Free Birds|Thanksgiving","650380","0","0","4987","https://i.ytimg.com/vi/TGLyNcO8LcA/default.jpg","False","True","Head to http://squarespace.com/schaffrillas to save 10% off your first purchase of a website or domain. Thanks to Squarespace for sponsoring this video!Schaff watches Free Birds and has his life changed forever.Editor's Channels:Citizen HAL: https://www.youtube.com/@2manymoviesPatreon: https://www.patreon.com/SchaffrillasTwitter: https://twitter.com/SchaffrillasRedbubble: https://www.redbubble.com/people/scha......Reddit: https://www.reddit.com/r/Schaffrillas...Esteemed $5+ Patrons:aheaney15Aiden McgillicuddyAmaru DejesusAlexandraAndre GutierrezAndrew YoungAnna ChanthaphavongAshley ForrestBATMANBooloboCG LemonadeCharlotte MChildish MemphinoClarissa WeeClownDuckCole JacksonCrimson CourtDaniel GoldhornDanmccouldDelaina RachelleDman990099Dr Noe ContextEdgar GutierrezEmily AllenEric BanksFlanFrancis SheepieGabi ChristieGabriel Vega BarretoGavin T360HanksharkHarvey MulvihillIan SeebachJacob BaumJacob LaBossiereJake AlbertJake GJonathan KermanianJosephJuan-the-DingusJustin GonzalesKim TrakartwichitKingsDayLeif BradshawLogan McQuaidMatt FernandesMichael David RoseMichael ThomasMigsMilkyMilosz KluskiMirrorWqveNessieNight Man52NoneLovesMeOceanechoesOlivia MendelOsbers GamingPeriPeter HollensPierre DesbrieresPinkiePotPiePrismabunnyPut 9-Volt in Smash Bros. PleaseQuetzal the SnekrEactorReagan DeFrieceRebel FriendRed Mustached AlienRocco DamianoRoscoesDadRyland TewsSassyScott St JeanSeth HowellSolocoSuarezSugargaeSuperJimmy978Tailored MuffinTeaselThat Guy Named RaiThe GAG ReflexThe TARDIS Pig/TCTomToxic shockTyler RumboldUncultured SwineVellum TonyVintageVolianerWafflegamrWinnyYINSED"
"ZmIU1hnEvjE","Nyjah Huston's Shine On Part","2022-11-14T17:00:32Z","UCt16NSYjauKclK67LCXvQyA","ThrasherMagazine","17","22.17.11","Thrasher|Magazine|Thrasher Magazine|King Of The Road|Firing Line|Double Rock|Skateboarding|Skate|Kickflip|Hall of Meat|Full Part","447472","0","0","3465","https://i.ytimg.com/vi/ZmIU1hnEvjE/default.jpg","False","True","At the height of his powers, Nyjah relentlessly pursues the realm of the impossible. Send and Destroy. Keep up with Thrasher Magazine here:http://www.thrashermagazine.comhttp://www.facebook.com/thrashermagazinehttp://www.instagram.com/thrashermaghttp://www.twitter.com/thrashermag"
"avf3wH_4ejw","BEST FRIEND TEST: BETA SQUAD EDITION","2022-11-14T20:52:15Z","UCxOzbkk0bdVl6-tH1Fcajfg","Beta Squad","24","22.17.11","best friend|friend test|best friend tag|challenge|quiz|beta squad|chunkz|yung filly|darkest man|niko omilana|aj shabeel|king kenny|sharky|best friend challenge","2593777","0","0","3062","https://i.ytimg.com/vi/avf3wH_4ejw/default.jpg","False","True","Today the Beta Squad test their friendships with a best friend challenge.Subscribe to everyone! @Aj Shabeel @Sharky @Chunkz  @Niko Omilana @KingKennyTv Follow us on Social Media to stay connected!Twitter ► https://twitter.com/BetaSquad5Instagram ►  https://www.instagram.com/betasquad5"
"w_sNvn_LpX0","Rio Reacts - Ronaldo's Exclusive Interview FT. Jamie Carragher.","2022-11-14T14:26:09Z","UCPAiS32go3-GwTO0kmlVX7g","Rio Ferdinand Presents FIVE","24","22.17.11","Rio Ferdinand|Rio|Ferdinand|5 Rio Ferdinand|Rio Ferdinand interview|football|soccer|football skills|interview|Manchester United|Man United|MUFC|MOTD|Sky Sports|Post Match Interview|Man Utd highlights|Champions League|Premier League|Joel Beya|Stephen Howson|BT Sport|Cristiano Ronaldo|Ten Hag|Paul Pogba|Liverpool|Man City|Arsenal|Chelsea|AFTV|United Stand|United view|Don Robbie|Bein Sport|Wayne Rooney|Old trafford|Fans|Tottenham|F2|Fabrizio Romano","1096773","0","0","4340","https://i.ytimg.com/vi/w_sNvn_LpX0/default.jpg","False","True","Welcome back to the FIVE YT Channel today Vibe with Five is back with an exclusive episode! Rio Ferdinand, Joel Beya and Stephen Howson are back in the studio today with a special guest, Jamie Carragher.  They give their reaction to the bombshell interview trailered last night with Piers Morgan interviewing Cristiano Ronaldo! What is Jamie Carragher’s views on the events that have occurred? What does Rio Ferdinand think of the situation and how it will affect the club? Has Cristiano Ronaldo been treated wrongly by the club? Does Cristiano Ronaldo’s stature warrant a different approach to other players when being dealt with? Has Ten Hag dealt with the situation properly? All this and much more on this exclusive episode of Vibe with Five! 0:00; - Intro0:32; - Jamie Carragher’s tweets about Ronaldo’s interview1:28; - The protection Steven Gerrard got from Jamie Carragher2:59; - Rio expresses a respect to Jamie for calling him out on Twitter3:20; - Does Cristiano genuinely want to leave the club?4:39; - Was there a huge lack of communication between Ronaldo and Manchester United?7:37; - Is Cristiano a huge liability for the club?9:09; - What was Manchester United’s initial plan for Cristiano Ronaldo before the start of this season?10:31; - Has Eric ten Hag handled Ronaldo's situation eventually?11:44; - What does the future holds for both sides of the conflict?12:33; - Is Rio backing Ronaldo after what the Portuguese did? Yes or No!13:45; - Is Cristiano just trying to justify himself to leave the club?14:17; - Was Ralph Rangnick’s coming to the club a mistake?17:10; - Would Jamie have let Cristiano leave the club for Manchester City?18:52; - What will be MUFC fans’ reaction to the interview and Ronaldo’s figure afterwards?21:37; - Guys are summarizing the results of the meeting with Jamie23:05; - What’s happened between Rooney and CR7?23:40; - Rio’s thoughts on the whole situation25:12; - What was the main point of Ronaldo’s interview?26:38; - OutroSubscribe: http://bit.ly/15QO9WEFIVE UK IG: https://instagram.com/fiveukFIVE UK Twitter: https://twitter.com/fiveukRio Ferdinand IG: https://instagram.com/rioferdy5Rio Ferdinand Twitter: https://twitter.com/rioferdy5Jamie Carragher TW: https://twitter.com/carra23Jamie Carragher IG: https://instagram.com/23_carra Joel Beya IG: https://instagram.com/joelbeya1Joel Beya Twitter: https://twitter.com/joelbeyaStephen Howson IG: https://instagram.com/mrstephenhowsonStephen Howson Twitter: https://twitter.com/mrstephenhowson#five #rioferdinand"
"eNccmTr9ZC8","G Herbo - Him (Official Music Video)","2022-11-15T17:00:24Z","UCV0pIPt5HFfulonNog3cz1A","G Herbo","10","22.17.11","G herbo|g herbo 2020|g herbo official|g herbo music|swervo|g herbo servivors remorse|survivors remorse g herbo|g herbo new music video|g herbo him|him official music video|g herbo him lyrics","357582","0","0","1019","https://i.ytimg.com/vi/eNccmTr9ZC8/default.jpg","False","True","Official music video for G Herbo Him, available to stream now: https://GHerbo.lnk.to/SurvivorsRemorseSubscribe to G Herbo's official channel for exclusive music videos & behind the scenes footage: http://bit.ly/Subscribe-to-GHerboFollow G Herbo:https://fb.com/gherbomusichttp://twitter.com/gherbohttps://instagram.com/nolimitherbohttps://soundcloud.com/gherbohttp://spoti.fi/1LwQTBk http://gherbomusic.com#GHerbo #SurvivorsRemorse"
"8gfqh-ZrHY8","Michelle Obama x Colbert - EXTENDED INTERVIEW","2022-11-15T05:15:00Z","UCMtFAi84ehTSYSE9XoHefig","The Late Show with Stephen Colbert","24","22.17.11","The Late Show|Late Show|Stephen Colbert|Steven Colbert|Colbert|celebrity|celeb|celebrities|late night|talk show|comedian|comedy|CBS|joke|jokes|funny|funny video|funny videos|humor|hollywood|famous","1215742","0","0","3844","https://i.ytimg.com/vi/8gfqh-ZrHY8/default.jpg","False","True","Former First Lady Michelle Obama joins Stephen Colbert for a wide-ranging conversation that includes a peek into the Obama family's private life, her thoughts on the Jan 6th insurrection, and the message to young people contained in her new book, The Light We Carry, which is available everywhere now.  #Colbert #MichelleObama #Obama #TheLightWeCarrySubscribe To The Late Show Channel: http://bit.ly/ColbertYouTubeWatch full episodes of The Late Show: http://bit.ly/1Puei40Listen to The Late Show Pod Show podcast: https://link.chtbl.com/Awagtx95?sid=ytLike The Late Show on Facebook: http://on.fb.me/1df139YFollow The Late Show on Twitter: http://bit.ly/1dMzZzGFollow The Late Show on Instagram: http://bit.ly/29wfREjWatch The Late Show with Stephen Colbert weeknights at 11:35 PM ET/10:35 PM CT. Only on CBS.---The Late Show with Stephen Colbert is the premier late night talk show on CBS, airing at 11:35pm EST, streaming online via Paramount+, and delivered to the International Space Station on a USB drive taped to a weather balloon. Every night, viewers can expect: Comedy, humor, funny moments, witty interviews, celebrities, famous people, movie stars, bits, humorous celebrities doing bits, funny celebs, big group photos of every star from Hollywood, even the reclusive ones, plus also jokes."
"D2zdwrv5H6M","We Spent £100,000 On MrBeast’s Credit Card Ft Speed","2022-11-13T15:11:22Z","UCv-GNHtqM97EaU_i7gN_Ikw","Chunkz","24","22.17.11","Chunkz Entertainment|comedy|family friendly|Funny Challenges Fun","5585155","0","0","8254","https://i.ytimg.com/vi/D2zdwrv5H6M/default.jpg","False","True","Subscribe: https://bit.ly/2PGvXfx | 🔔Make sure to enable ALL push notifications!🔔Watch the NEWEST videos: https://bit.ly/2PzaVSYFollow Chunkz :Instagram: https://instagram.com/chunkz_en/Twitter: https://twitter.com/Chunkz_ENSnapChat: https://snapchat.com/add/SpiceggWatch more Chunkz :1V1 RAP BATTLE: https://bit.ly/2RY6Ar1COOKING WITH CHUNKZ: https://bit.ly/2pWEXlc2V2 RAP BATTLE: https://bit.ly/2RYtyOHLatest Videos: https://bit.ly/2PzaVSYPopular Videos: https://bit.ly/2yGdppi"
"FnUFsvPc4Qo","Trying EVERY Cheerios flavor to VERY surprising results.","2022-11-14T18:00:14Z","UCXq2nALoSbxLMehAvYTxt_A","The Grumps","23","22.17.11","10 minute power hour|ten minute power hour|game grumps|egoraptor|game grumps live action|arin|funny|danny|game grumps power hour|gamegrumps|arin and dan|10mph|tmph|game grumps real life|grumps power hour|honey nut cheerios|cereal|cheerios commercial|breakfast","382688","0","0","2594","https://i.ytimg.com/vi/FnUFsvPc4Qo/default.jpg","False","True","It's not just the taste. It's the smell. Click to SUBSCRIBE ► http://bit.ly/TheGrumpsMERCH!! ► http://gamegrumps.com/merchOur email list! ► http://bit.ly/GrumpsStuffEmail*********************************************We have NEW MERCH every FRIDAY! Visit our WEBSITE every FRIDAY to check out the NEW items!►►► http://gamegrumps.com/merch*********************************************FACEBOOK ► https://www.facebook.com/GameGrumpsTWITTER ► https://www.twitter.com/gamegrumpsINSTAGRAM ► https://www.instagram.com/gamegrumps/WEBSITE ► http://gamegrumps.com*********************************************Game Grumps are:Arin ► http://www.youtube.com/EgoraptorDanny ► http://www.youtube.com/NinjaSexParty#TheGrumps #10MPH #CheerioTasteTest"
"-Y6PuhBC3Cw","How I Lost A $2.5 Million Jet To MrBeast","2022-11-13T18:01:16Z","UCdcUmdOxMrhRjKMw-BX19AA","Niko Omilana","24","22.17.11","Mrbeast|Mr beast|Niko Omilana|Niko","2404416","0","0","3784","https://i.ytimg.com/vi/-Y6PuhBC3Cw/default.jpg","False","True","Mr Beast hurt my feelings.Follow me on Instagram- http://instagram.com/nikoClothing- https://www.shopndl.com/Follow me on Twitter- https://twitter.com/NikoOmilanaBusiness Email - Nikoenquiries@gmail.com"
"aqW4xXUgmno","[CHOREOGRAPHY] BTS (방탄소년단) '달려라 방탄 (Run BTS)' Dance Practice","2022-11-13T10:00:02Z","UCLkAepWjdylmXSltofFvsYQ","BANGTANTV","10","22.17.11","방탄소년단|BTS|BANGTAN|알엠|RM|슈가|SUGA|제이홉|jhope|지민|정국|k-pop|방탄|j-hope|Jung Kook|Jimin|BTS V|Jin","19669289","0","0","89384","https://i.ytimg.com/vi/aqW4xXUgmno/default.jpg","False","True","#BTS #방탄소년단 #달려라방탄 #RunBTS Connect with BTS: https://ibighit.com/bts http://twitter.com/BTS_bighithttp://twitter.com/BTS_twt http://www.facebook.com/bangtan.official https://www.youtube.com/user/BANGTANTV http://instagram.com/BTS.bighitofficial https://channels.vlive.tv/FE619 https://www.tiktok.com/@bts_official_bighithttps://weverse.onelink.me/qt3S/94808190https://www.weibo.com/BTSbighithttps://www.weibo.com/BTSmembers http://btsblog.ibighit.com"
